title,dataset_global_id
Why do citizens (not) support democratic innovations? The role of instrumental motivations in support for participatory budgeting,10.7910/DVN/YOKCX6
"Replication Data for: High Valuations, Uncertainty, and War",10.7910/DVN/FGDBKR
Replication Data for: Reassessing the Public Goods Theory of Alliances,10.7910/DVN/LCNABE
Replication Data for: Replication Data for: Dealing With Measurement Error in List Experiments: Choosing the Right Control List Design,10.7910/DVN/DNHS7F
Replication Data for: The Limited Effects of Partisan and Consensus Messaging in Correcting Science Misperceptions,10.7910/DVN/98RISM
"Replication Data for: Harms, Philipp, Claudia Landwehr, Maximilian Lutz and Markus Tepe 2021. Deciding how to decide on public goods provision: The role of instrumental vs. intrinsic motives. Research & Politics",10.7910/DVN/9ZW4CY
Replication Data for: Transfer Learning for Topic Labeling: Analysis of the UK House of Commons Speeches 1935-2014,10.7910/DVN/DT3KUE
Replication Data for: Accessibility and Generalizability: Are Social Media Effects Moderated by Age or Digital Literacy?,10.7910/DVN/L0RVXJ
Replication Data for: Anomalous Responses on Amazon Mechanical Turk: An Indian Perspective,10.7910/DVN/KVJMEZ
Replication Data for: Sticks and Carrots for Peace: The Effect of Manipulative Mediation Strategies on Post-Conflict Stability,10.7910/DVN/OPIPYE
"Replication data for ""Clarifying the Mediation Dilemma: A Response to ‘Sticks and Carrots for Peace’""",10.7910/DVN/ATU1XB
Replication Data for: What Type of Democracy Do Chileans Want?,10.7910/DVN/PC0TLQ
Replication Data for: Self-Coding: A Method to Assess Semantic Validity and Bias when Coding Open-Ended Responses,10.7910/DVN/E4AJZF
Replication Data for: Territorial Wars and Absolute Outcomes,10.7910/DVN/YCRIPD
"Replication Data for: ""Age Is Measured with Systematic Measurement Error in Developing Country Surveys: A Diagnosis and Analysis of Consequences""",10.7910/DVN/CJ5XWZ
Replication data for: Voting Made Safe and Easy: The Impact of e-voting on Citizen Perceptions,10.7910/DVN/24896
"Replication data for: Analyzing Manifestos in their Electoral Context: A New Approach Applied to Austria, 2002â2008",10.7910/DVN/27864
Replication data for: Voting in a Multidimensional Space: A Conjoint Analysis Employing Valence and Ideology Attributes of Candidates,10.7910/DVN/26639
"Replication data for: Political Depolarization in German Public Opinion, 1980–2010",10.7910/DVN/EVLM9Q
Replication data for: Pivotality and Turnout: Evidence from a Field Experiment in the Aftermath of a Tied Election,10.7910/DVN/24034
Replication data for: You've Got Some Explaining To Do: The Influence of Economic Conditions and Spatial Competition on Party Strategy,10.7910/DVN/26347
Replication data for: Candidate Confidence and Electoral Appeal: An Experimental Study of the Effect of Nonverbal Confidence on Voter Evaluations,10.7910/DVN/26129
Replication data for: Using Sequences to Model Crises,10.7910/DVN/25593
Replication data for: Explaining Fixed Effects: Random Effects modelling of Time-Series Cross-Sectional and Panel Data,10.7910/DVN/23415
Replication Data for: The Opportunity Cost of Conflict: Statistically  Comparing Israel and Synthetic Israel,10.7910/DVN/29401
Inflated Expectations: How government partisanship shapes bureaucrats' inflation expectations,10.7910/DVN/25730
Replication data for: Another Great Illusion: The Advancement of Separatism through Economic Integration,10.7910/DVN/22808
"Replication data for: Inequality, Aspirations, and Social Comparisons",10.7910/DVN/27455
"Replication data for: ""Don't Know"" Responses, Personality and the Measurement of Political Knowledge",10.7910/DVN/29707
Replication data for: Economic Policy Voting and Incumbency: Unemployment in Western Europe,10.7910/DVN/1B9IYE
,10.7910/DVN/26972
Replication data for: How Much of the Incumbency Advantage is Due to Scare-off?,10.7910/DVN/27279
Replication data for: Fiscal Governance in the Eurozone: How effectively does the Stability and Growth Pact limit governmental debt in the Euro countries?,10.7910/DVN/24640
Replication data for: The Role of Party Identification in Spatial Models of Voting Choice,10.7910/DVN/27194
Replication data for: Unequal We Fight: Between- and Within-Group Inequality and Ethnic Civil War,10.7910/DVN/27201
COMMITMENT PROBLEMS IN COALITIONS: A NEW LOOK AT THE FISCAL POLICIES OF MULTI-PARTY GOVERNMENTS,10.7910/DVN/27742
Replication data for: Spatial- and Spatiotemporal-Autoregressive Probit Models of Interdependent Binary Outcomes,10.7910/DVN/28322
Replication data for: Competitive Learning in Yardstick Competition: Testing Models of Policy Diffusion With Performance Data,10.7910/DVN/B4VBVM
Replication data for: Opposition Parties and the Timing of Successful No-Confidence Motions,10.7910/DVN/28458
Replication data for:Partisan Presidential Influence over U.S. Federal Budgetary Outcomes:  Evidence from a Stochastic Decomposition of Executive Budget Proposals *,10.7910/DVN/24129
Replication data for: Constructing Congressional Activity: Uncertainty and the Dynamics of Legislative Attention,10.7910/DVN/27765
Replication data for: A Quantitative Method for Substantive Robustness Assessment,10.7910/DVN/25791
Replication data for: Testing Core Predictions of Spatial Models: Platform Moderation and Challenger Success,10.7910/DVN/26681
"Replication data for: Regular Voters, Marginal Voters, and the Electoral Effects of Turnout",10.7910/DVN/26651
Replication data for: Party System Nationalization and the Provision of Public Health Services,10.7910/DVN/27471
Replication data for: From Posting to Voting: The Effects of Political Competition on Online Political Engagement,10.7910/DVN/26546
Replication data for: Citizens or Clients? Evidence on Opportunistic Voting from a Natural Experiment in Greece,10.7910/DVN/27809
Replication data for: Elections and Civil War in Africa,10.7910/DVN/29280
Replication data for: The Difference Between Actual and Perceived Survey Measures and the Implications for Political Socialization Research,10.7910/DVN/27296
Replication data for: Adding another level: individual responses to globalization and government welfare policies,10.7910/DVN/26063
Replication data for: Assessing the Correspondence between Experimental Results Obtained in the Lab and Field: A Review of Recent Social Science,10.7910/DVN/25543
Replication data for: Drawing Your Senator From a Jar: Term Length and Legislative Behavior,10.7910/DVN/26253
Replication data for: Should I Use Fixed or Random Effects?,10.7910/DVN/25588
Replication data for: Some Simple Tests of Rational Voting and Agenda-Setting,10.7910/DVN/25893
Replication data for: Globalization and the Demand-Side of Politics. How globalization shapes labor market risk perceptions and policy preferences,10.7910/DVN/27825
Replication data for: The DIstributive Effects of Corruption,10.7910/DVN/23449
Replication data for: Estimating Intra-Party Preferences: Comparing Speeches to Votes,10.7910/DVN/27702
Replication data for: Life of Brian Revisited: Assessing Informational and Non-Informational Leadership Tools,10.7910/DVN/BPW9KE
Replication data for: What to do about Atheoretic Lags,10.7910/DVN/29362
"Replication data for: Governments, Parliaments, and Legislative Activity",10.7910/DVN/27333
Replication data for: Natural Experiments Based on Geography,10.7910/DVN/26498
Replication data for: Rooting Out Corruption or Rooting for Corruption? The Heterogeneous Electoral Consequences of Scandals.,10.7910/DVN/26823
Replication data for: Forecasts of the 2012 U.S. presidential election based on  candidates’ perceived competence in handling the most important issue,10.7910/DVN/22949
Replication data for: Identifying the Effect of All-Mail Elections on Turnout: Staggered Reform in the Evergreen State,10.7910/DVN/4QXBNS
Replication data for: Issue engagement in election campaigns: the impact of electoral incentives and organizational constraints,10.7910/DVN/27716
"Replication data for: Preferences, Problems and Representation",10.7910/DVN/27496
Replication data for: Government-Opposition or Left-Right? The Institutional Determinants of Voting in Legislatures,10.7910/DVN/26530
Replication data for: Does Survey Participation Increase Voter Turnout? Re-examining the Hawthorne Effect in the Swedish National Election Studies,10.7910/DVN/25300
Replication data for: A New Approach to Estimating Electoral Instability in Parties,10.7910/DVN/26707
"Replication data for: Regime Type, Coalition Size, and Victory",10.7910/DVN/27960
Rationalist Experiments on War,10.7910/DVN/XYPQUL
Replication Data for: The Effect of Electoral Systems on Voter Turnout: Evidence from a Natural Experiment,10.7910/DVN/DMAENL
Replication Data for Alliances and the High Politics of International Trade,10.7910/DVN/EOLEAY
"Replication Data for: ""The Spatial Dimensions of State Fiscal Capacity: The Mechanisms of International Influence on Domestic Extractive Efforts""",10.7910/DVN/VPTTOB
Replication Data for Coalition governments and party competition: Political communication strategies of coalition parties,10.7910/DVN/PZC0DM
"Replication Data for: Heuristics, Heterogeneity and Green Choices: Voting on California's Proposition 23",10.7910/DVN/TYJUPT
Replication Data for: Systemic Effects of Campaign Spending: Evidence From Corporate Contribution Bans in U.S. State Legislatures,10.7910/DVN/HWC6OA
Replication Data for: Partisan Disagreements Arising from Rationalization of Common Information,10.7910/DVN/WLLMIP
"Replication Data for ""Electoral Competitiveness and Turnout in British Elections, 1964-2010""",10.7910/DVN/FAWCGP
Hubs of Governance: Path-Dependence and Higher-order Effects of PTA Formation,10.7910/DVN/S73SLI
"Replication Data for ""Counterbalancing, Spatial Dependence, and Peer-Group Effects"" (Forthcoming in Political Science Research and Methods)",10.7910/DVN/XSML4R
A Bayesian Approach to Dynamic Panel Models with Endogenous Rarely Changing Variables,10.7910/DVN/08RCPK
Replication Data for: Estimating Uncertainty in Party Policy Positions Using the Confrontational Approach,10.7910/DVN/EISRTA
"Replication Data for: ""Comparing Strategies for Estimating Constituency Opinion from National Survey Samples""",10.7910/DVN/IVNNBK
Replication Data for: A Political Economy of Income Tax Policies,10.7910/DVN/DHK2Q6
"Replication Data for: Acting Right? Privatization, Encompassing Interests, and the Left",10.7910/DVN/MKC1HA
"Replication Data for: Every Story Has a Beginning, Middle, and an End (But Not Always in That Order): Predicting Duration Dynamics in a Unified Framework",10.7910/DVN/N5IF8R
Replication Data for: Mode Matters: Evaluating Response Comparability in a Mixed-Mode Survey,10.7910/DVN/6HJ5KL
Hazards or Hassles: The Effect of Sanctions on Leader Survival,10.7910/DVN/PVMZB1
Replication Data for: Estimating Uncertainty in Party Policy Positions Using the Confrontational Approach,10.7910/DVN/UYZMLG
Replication Data for: Addressing Endogeneity in Actor-Specific Network Measures,10.7910/DVN/BKPIEV
Replication Data for: Separating candidate valence and proximity voting: Determinants of competitors' non-policy appeal,10.7910/DVN/WFDNNL
Replication Data for Does Information Lead to Emulation? Spatial Dependence in Anti-Government Violence,10.7910/DVN/CTRV5Z
Replication Data for: Prejudice and Politics Re-examined: The Political Significance of Implicit Racial Bias,10.7910/DVN/HPXGBH
"Replication Data for: ""Primaries and Candidates: Examining the Influence of Primary Electorates on Candidate Ideology""",10.7910/DVN/6BLQOE
Replication Data for: Regions at Risk: Predicting Conflict Zones in African Insurgencies,10.7910/DVN/Q8T87R
Brother or Burden: An Experiment on Reducing Prejudice Toward Syrian Refugees in Turkey,10.7910/DVN/ORTDUM
Distinguishing Occasional Abstention from Routine Indifference in Models of Vote Choice,10.7910/DVN/3JR2YL
"Replication Data for: ""Dependency Status and Demand for Social Insurance: evidence from experiments and surveys""",10.7910/DVN/2IT7IF
Replication data for Measuring Emotional Response: Comparing Alternative Approaches to Measurement,10.7910/DVN/OZ0MNZ
Replication Data for: Reform and Representation: A New Method Applied to Recent Electoral Changes,10.7910/DVN/5AYBI9
Replication Data for: Ideology and the US Congressional Vote,10.7910/DVN/4NNGJ9
Replication Data for: The Correlates of Media Freedom: An Introduction of the Global Media Freedom Dataset,10.7910/DVN/ZIW50K
Replication Data for: Gaffe Appeal: A Field Experiment on Partisan Selective Exposure to Election Messages,10.7910/DVN/FJP8AR
Replication Data for: Compression and Conditional Effects,10.7910/DVN/ASSC0Y
Replication Data for: Veto Override Requirements and Executive Success,10.7910/DVN/XW0D8Q
Replication Data for:  Assessing Threats to Inference with Simultaneous Sensitivity Analysis: The Case of U.S. Supreme Court Oral Arguments,10.7910/DVN/AXCVFN
Replication Data for: Coalition Formation and Selectorate Theory: An Experiment,10.7910/DVN/18O6D8
Replication Data for: Protecting People from Natural Disasters: Political Institutions and Ocean-originated Hazards,10.7910/DVN/9GAUNG
"Replication Data for Income Perception, Information, and Progressive Taxation:  Evidence from a Survey Experiment ",10.7910/DVN/ODFY54
Replication Data for: Measuring Foreign Policy Positions of Members of the US Congress,10.7910/DVN/VO7WW5
"Replication Data for: Who Gets the Credit? Legislative Responsiveness and Evaluations of Members, Parties, and the US Congress",10.7910/DVN/YT8KWK
Minority Languages in Dictatorships: A New Measure of Group Recognition,10.7910/DVN/ZT7SIU
Measuring Elite Personality Using Speech,10.7910/DVN/JDH6KR
"Replication Data for: Relative Poverty, Perceived Violence, and Support for Militant Politics: Evidence from Pakistan",10.7910/DVN/ENFMZY
Replication Data for: Campaign Cost and Electoral Accountability,10.7910/DVN/ZVQJA0
Replication Data for Signaling By Signature: The Weight of International Opinion and Ratification of Treaties by Domestic Veto Players,10.7910/DVN/FYGY6V
Replication Data for: Insuring Against Past Perils: The Politics of Post-Currency Crisis Foreign Exchange Reserve Accumulation,10.7910/DVN/LOTWYP
"Heterogeneity in the Militarized Interstate Disputes (MIDs), 1816-2001: What Fatal MIDs Cannot Fix",10.7910/DVN/S27ZCY
Bounding causal effects in ecological inference problems,10.7910/DVN/Z3KRZZ
Replication Data for: Google Politics: The Political Determinants of Internet Censorship in Democracies,10.7910/DVN/Q0WIGS
Replication Data for: Democratization and Economic Output in Sub-­Saharan Africa,10.7910/DVN/I42PPJ
Replication Data for: Federal Democracy in the Laboratory,10.7910/DVN/JUCGYS
Replication Data for: Strategic ambiguity of party positions in multiparty competition,10.7910/DVN/GK9VCH
"Replication Data for: Fatality Thresholds, Causal Heterogeneity, and Civil War Research: Reconsidering the Link Between Narcotics and Conflict",10.7910/DVN/6CMBEI
Replication Data for: How Face-to-Face Interviews and Cognitive Skill affect Item Non-response: A randomized experiment assigning mode of interview,10.7910/DVN/FNG2TQ
Aggregate Effects of Large-Scale Campaigns on Voter Turnout,10.7910/DVN/BIZFP2
"Replication Data for: The Arc of Modernization: Economic Structure, Materialism, and the Onset of Civil Conflict",10.7910/DVN/IVPBRF
"Replication data for ""The Perverse Consequences of Policy Restrictions  in the Presence of Asymmetric Information""",10.7910/DVN/MOXXTL
Replication Data for: All Economics Is Local: Spatial Aggregations of Economic Information,10.7910/DVN/VXCUOU
Replication Data for: Don't Know What You Got: A Bayesian Hierarchical Model of Neuroticism and Nonresponse,10.7910/DVN/RVV3YW
Replication Data for: Information and Economic Voting,10.7910/DVN/MQUAPF
Replication Data for: Women's Issues and Their Fates in the United States Congress,10.7910/DVN/B1TZNE
Replication Data for: Heuristics in Context,10.7910/DVN/VLS3XL
Replication Data for: How to survey about electoral turnout? The efficacy of the face-saving response items in 19 different contexts,10.7910/DVN/B0NY7Y
Invalid Ballots and Electoral Competition,10.7910/DVN/IQVUAG
Replication Data for: Self-Selection and Misreporting in Legislative Surveys,10.7910/DVN/KY4YAA
Replication Data for: Which Matters Most: Party Strategic Exit or Voter Strategic Voting? A Laboratory Experiment,10.7910/DVN/TPARSF
Replication Data for: Income Measures in Cross-National Surveys: Problems and Solutions,10.7910/DVN/URSNLH
Replication Data for: Conceptions of Shari`a and Support for Militancy and Democratic Values: Evidence from Pakistan,10.7910/DVN/T9IKQT
Replication Data for: How to increase turnout in low-salience elections. Quasi-experimental evidence on the effect of concurrent second-order elections on political participation,10.7910/DVN/TJTZT2
Replication Data for: A general model of abstention under compulsory voting,10.7910/DVN/BZ5BLZ
Replication Data for: Diffusion in Congress: Measuring the Social Dynamics of Legislative Behavior,10.7910/DVN/CJZB8X
Replication Data for: Party Competition and the Inter-Industry Structure of U.S. Trade Protection,10.7910/DVN/MBDVCJ
Replication Data for: To Lag or Not to Lag? Re-evaluating the Use of Lagged Dependent Variables in Regression Analysis,10.7910/DVN/UERKTM
"Replication Data for Omitted Variables, Countervailing Effects, and The Possibility of Overadjustment",10.7910/DVN/BSKHUF
Enhancing Validity in Observational Settings When Replication is Not Possible,10.7910/DVN/O2BK85
Replication Data for: Parties Are No Civic Charities: Voter Contact and the Changing Partisan Composition of the Electorate,10.7910/DVN/EWISS3
Replication Data for: Why Legislative Networks? Analyzing Legislative Network Formation,10.7910/DVN/UDZZSH
The Politics of Scrutiny in Human Rights Monitoring: Evidence from Structural Topic Models of U.S. State Department Human Rights Reports,10.7910/DVN/W1QQTP
"Replication Data for: Conflict Management in Land, River, and Maritime Claims",10.7910/DVN/WXABMM
Replication Data for Luck of the Draw? Members’ Bills & the Electoral Connection,10.7910/DVN/EYVIDZ
"Replication Data for: Politically Unengaged, Distrusting, and Disaffected Individuals Drive the Link Between Compulsory Voting and Invalid Balloting",10.7910/DVN/FMZQMR
Replication Data for: Assessing the Impact of Non-Random Measurement Error on Inference: A Sensitivity Analysis Approach,10.7910/DVN/VX59QI
Replication Data for: Unreliable Inferences,10.7910/DVN/OQWCZE
How Campaigns Enhance European Issues Voting during European Parliament Elections,10.7910/DVN/QUIXMK
Replication Data for: African American Turnout and African American Candidates,10.7910/DVN/5IRGBG
Replication Data for: Personality and Prosocial Behavior: A Multilevel Meta-Analysis,10.7910/DVN/OBDQ3H
Replication Data for: Voting Behavior in the Council of the European Union: The Effect of the Trio Presidency,10.7910/DVN/UBAPZL
Replication Data for: Measuring Knowledge of Parties' Legislative Seat Shares,10.7910/DVN/NQ32VR
Replication Data for: How Chinese Officials Use the Internet to Construct their Public Image,10.7910/DVN/2HTWSU
Replication Data for: How Newspapers Reveal Political Power,10.7910/DVN/ZH5YFY
Replication Data for: Presidential Particularism and U.S. Trade Politics,10.7910/DVN/51N9A7
Replication Data for: When BLUE Is Not Best: Non-Normal Errors and the Linear Model.,10.7910/DVN/WZSUS3
Electoral Competition after Party Splits,10.7910/DVN/SYCAOH
Replication Data for: Non-Governmental Campaign Communication Providing Ballot Secrecy Assurances Increases Turnout: Results from Two Large Scale Experiments,10.7910/DVN/D8WD6K
Replication Data for Investigating Sequences in Ordinal Data: A New Approach with Adapted Evolutionary Models,10.7910/DVN/VJLWTZ
Replication Data for: Practical and Effective Approaches to Dealing with Clustered Data,10.7910/DVN/OGXF4X
It sounds like they’re moving: understanding and modelling emphasis-based policy change,10.7910/DVN/3BSCKY
Replication Data for: The Effects of Government System Fractionalization on Satisfaction with Democracy,10.7910/DVN/EU541C
Replication Data for: The Differential Impact of Threats on Ethnic Prejudice toward Three Minority Groups in Britain,10.7910/DVN/AR8SLA
Replication Data for: Theory and Methods in the Study of Distributive Politics,10.7910/DVN/QPZWZM
Engendering Bilateralism,10.7910/DVN/XL5659
Replication Data for: The impact of party cues on manual coding of political texts,10.7910/DVN/S2VOLH
Mobilizing Voters with Aggressive Metaphors,10.7910/DVN/QSGXZC
Replication Data for: Economic Perceptions and Electoral Choices: A Design-Based Approach,10.7910/DVN/BT7OZQ
Replication Data for: Immigration and Support for Social Policy. An Experimental Comparison of Universal and Means-Tested Programs,10.7910/DVN/8U4FFB
"Replication Data for: ""Scraping public co-occurrences for statistical network analysis of political elites""",10.7910/DVN/LYSP42
Replication Data for: International Migration and Military Intervention in Civil War,10.7910/DVN/OVOUAL
"Replication Data for: ""Are We Providing Enough to Those who have Too Little?  Measuring Poverty Relief""",10.7910/DVN/ZEKDIC
"Replication Data for ""Democracy For All: Conceptualizing and Measuring Egalitarian Democracy""",10.7910/DVN/Q0ROYU
Replication Data for: Analyzing Decision Records from Committees,10.7910/DVN/HEMHMH
Replication Data for: Comparing Dynamic Pies: A Strategy for Modeling Compositional Variables in Time and Space,10.7910/DVN/XHW4CB
Replication Data for: Bayesian versus maximum likelihood estimation of treatment effects in bivariate probit instrumental variable models,10.7910/DVN/GQQUQU
Replication data for Competing with the dragon: Employment effects of Chinese trade competition in 17 sectors across 18 OECD countries,10.7910/DVN/ZJDLGE
Replication Data for: How Does Media Influence Social Norms? Experimental Evidence on the Role of Common Knowledge,10.7910/DVN/YAIXFQ
Replication Data for: Elites Tweet to get Feet off the Streets: Measuring Regime Social Media Strategies During Protest,10.7910/DVN/AMYHNJ
Replication Data for: On the Dynamics of Ideological Identification: The Puzzle of Liberal Identification Decline,10.7910/DVN/V8D7KT
"Geography, Uncertainty, and Polarization",10.7910/DVN/Z7H44N
Replication Data for Government Instability and the State,10.7910/DVN/6WUWRB
Replication Data for: Generalizing from Survey Experiments Conducted on Mechanical Turk: A Replication Approach,10.7910/DVN/F1CFFM
"Replication Data for: Property Rights Regimes, Technological Innovation, and Foreign Direct Investment",10.7910/DVN/P5SZTR
Replication Data for: The Sensitivity of Sensitivity Analysis,10.7910/DVN/PBEOJZ
"Replication Data for Platforms, Portfolios, Policy: How Audience Costs Affect Social Welfare Policy in Multiparty Cabinets",10.7910/DVN/ULCSUG
Replication Data for: Modeling Related Processes with an Excess of Zeros,10.7910/DVN/ZWEA8L
"Replication Data for: Voter Uncertainty, Political Institutions, and Legislative Turnover",10.7910/DVN/1Q2Z92
Replication Data for: Is Political Knowledge Unique?,10.7910/DVN/GXUY81
Replication Data for: Improving the Interpretation of Fixed Effects Regression Results,10.7910/DVN/RLWSVJ
Replication Data for: Attitudes toward Economic Inequality: The Illusory Agreement,10.7910/DVN/GKMZHD
Replication Data for: The Prevalence and Severity of Underreporting Bias in Machine and Human Coded Data,10.7910/DVN/CFCZ2L
Replication Data for: Maps in People’s Heads: Assessing A New Measure of Context,10.7910/DVN/9XWGHN
Replication Data for: The Logic of Authoritarian Political Selection: Evidence from a Conjoint Experiment in China,10.7910/DVN/SLZ2OA
Understanding Equation Balance in Time Series Regression: An Extension,10.7910/DVN/MPI4MW
Replication Data for: Contested Ground: Disentangling Material and Symbolic Attachment to Disputed Territory,10.7910/DVN/INCWQN
Replication Data for: Simulating Duration Data for the Cox Model,10.7910/DVN/1YG7BI
The Fifty American States in Space and Time: Applying Conditionally Autoregressive Models,10.7910/DVN/XW1YYI
Replication Data for: Critical Events and Attitude Change: Support for Gun Control After Mass Shootings,10.7910/DVN/1SBYFJ
"Replication Data for: Recruiting Large Online Samples in the United States and India: Facebook, Mechanical Turk and Qualtrics",10.7910/DVN/K6PRPG
"Replication Data for: ""Lost in Space: Geolocation in Event Data""",10.7910/DVN/U4Q0FR
Replication Data for: The Electoral Costs of Policy Commitments,10.7910/DVN/KSQ3NG
Replication Data for: Social Democratic Representation and Welfare Spending: A Quantitative Case Study,10.7910/DVN/ZTXLHG
Replication Data for: Does Residential Sorting Explain Geographic Polarization?,10.7910/DVN/EH8ZMX
Replication Data for: Quota Sampling Using Facebook Advertisements,10.7910/DVN/XTXS4P
Replication Data for: Identifying Voter Preferences for Politicians' Personal Attributes: A Conjoint Experiment in Japan,10.7910/DVN/KCIADO
Replication Data for: Fixed Effects in Rare Events Data: A Penalized Maximum Likelihood Solution,10.7910/DVN/H7QR3Q
Replication Data for: Exploring Disagreement in Indicators of State Repression,10.7910/DVN/V5LB9K
Replication Data for:  A Textual Taylor Rule: Estimating Central Bank Preferences Combining Topic and Scaling Methods,10.7910/DVN/SGB8FE
Replication Data for: Causal Modeling with Multi-Value and Fuzzy-Set Coincidence Analysis,10.7910/DVN/YIEAF1
Replication Data for: Is it worth door-knocking? Evidence from a UK-based GOTV field experiment on the effect of party leaflets and canvass visits on voter turnout,10.7910/DVN/VEZ66S
Replication Data for: Jumping Ship or Jumping on the Bandwagon: When Do Local Politicians Support National Candidates?,10.7910/DVN/SDGTMU
Replication Data for: Information Credibility and Responses to Corruption: A Replication and Extension in Argentina,10.7910/DVN/4BPRUI
