title,dataset_global_id
All Crises are Global: Capital Cycles in an Imbalanced International Political Economy,10.7910/DVN/CTMZX8
Service Firms in the Politics of US Trade Policy,10.7910/DVN/BTUTYP
"Life, Death, or Zombie? The Vitality of International Organizations",10.7910/DVN/2QS4R8
Only Here to Help? Bargaining and the Perverse Incentives of International Institutions,10.7910/DVN/0UNYW3
"Financial Data Transparency, International Institutions, and Sovereign Borrowing Costs",10.7910/DVN/FAG8BP
When Will States Strike First? Battlefield Advantages and Rationalist War,10.7910/DVN/P3SPTY
Killing Two Birds with One Stone? Examining the Diffusion Effect of Militant Leadership Decapitation,10.7910/DVN/VFNSX6
Commercial Diplomacy and Political Risk,10.7910/DVN/MJ4RFL
The New Public Address System: Why Do World Leaders Adopt Social Media?,10.7910/DVN/TF046M
The Things They Carried: Generational Effects of the Vietnam War on Elite Opinion,10.7910/DVN/2AV2CC
The Rise Predicts the Fall: How the Method of Leader Entry Affects the Method of Leader Removal in Dictatorships,10.7910/DVN/B47FTE
Elections and Capital Flight: Evidence from Africa,10.7910/DVN/4L80PR
A Comparative Analysis of Inequality and Redistribution in Democracies,10.7910/DVN/EM3QGY
Apples and Dragon Fruits: The Determinants of Aid and Other Forms of State Financing from China to Africa,10.7910/DVN/RTFF2X
Bypass Aid and Unrest in Autocracies,10.7910/DVN/3YK0HL
"Voters Get What They Want (When They Pay Attention): Human Rights, Policy Benefits, and Foreign Aid",10.7910/DVN/TLBTYD
Cleansing the Caliphate: Insurgent Violence against Sexual Minorities,10.7910/DVN/VMOCHO
"State Capacity, Insurgency, and Civil War: A Disaggregated Analysis",10.7910/DVN/G8AF5G
Mass Media and the Diffusion of Collective Action in Authoritarian Regimes: The June 1953 East German Uprising,10.7910/DVN/56L9JP
"How to Keep Officers in the Barracks: Causes, Agents, and Types of Military Coups",10.7910/DVN/N1DE4Q
"Intra-Industry Trade, Global Value Chains, and Preferential Tariff Liberalization",10.7910/DVN/JOBDDI
"Political Relations, Leader Stability, and Economic Coercion",10.7910/DVN/BEAPLB
The Intertemporal Tradeoff in Mobilizing Support for War,10.7910/DVN/YGKKRU
Monopoly Rents and Foreign Direct Investment in Fixed Assets,10.7910/DVN/2NDL6R
The Value of Precision in Probability Assessment: Evidence from a Large-Scale Geopolitical Forecasting Tournament,10.7910/DVN/D9FAZL
Resisting Rights to Renounce Imperialism: East African Churches’ Strategic Symbolic Resistance to LGBTQ Inclusion,10.7910/DVN/DVMT2R
"Selecting for Shame: The Monitoring of Workers’ Rights by the International Labour Organization, 1989 to 2011",10.7910/DVN/FSKY7K
Human Rights and Democratic Arms Transfers: Rhetoric Versus Reality with Different Types of Major Weapon Systems,10.7910/DVN/BEOQV2
Symposium: Popular Culture Matters,10.7910/DVN/OEBTZA
Symposium: The Constraining Effect of Arms Control Treaties,10.7910/DVN/QPQBFB
"The Legacy Of Wartime Violence on Intimate-Partner Abuse: Microlevel Evidence from Peru, 1980-2009",10.7910/DVN/GFBDQO
Replication Data for: Moral Hazard and Financial Crises: Evidence from American Troop Deployments,10.7910/DVN/O7WKNO
"Replication Data for: Coup-Proofing in the Shadow of Intervention: Alliances, Moral Hazard, and Violence in Authoritarian Regimes",10.7910/DVN/2IO3DL
Symposium: Culture and Otherness in Principal-Agent Theory,10.7910/DVN/2BKCC0
Replication Data for: Immigration and International Law,10.7910/DVN/IMVRJG
Replication Data for: Domestic Demand for Human Rights: Free Speech and the Freedom-Security Trade-Off,10.7910/DVN/6EOZAY
"Replication Data for: Fuel Subsidies Limit Democratization: Evidence from a Global Sample, 1990–2014",10.7910/DVN/0J05KV
Replication Data for: The Promise and Peril of Peacekeeping Economies,10.7910/DVN/S9VBBL
Replication Data for: Tariff Evasion and Trade Policies,10.7910/DVN/H9XFYR
Replication Data for: Compensating Autocratic Elites: How International Demands for Economic Liberalization Can Lead to More Repressive Dictatorships,10.7910/DVN/BBXQIT
Replication Data for: What Were the Consequences of Decolonization?,10.7910/DVN/SVSLO2
Replication Data for: History and Ethnic Conflict: Does Precolonial Centralization Matter?,10.7910/DVN/E9O8QK
"Replication Data for: Can We Change the Topic, Please? Assessing the Theoretical Construction of International Relations Scholarship",10.7910/DVN/JLAWY2
Replication Data for: Words Matter: How WTO Rulings Handle Controversy,10.7910/DVN/74JESF
"Replication Data for: The Strength of Weak Review: National Courts, Interpretive Canons, and Human Rights Treaties",10.7910/DVN/YNA0IL
Replication Data for: Tracing the Legacy: China's Historical Aid an d Contemporary Investment in Africa,10.7910/DVN/TK9JNU
"Replication Data for: David and Goliath? Small Developing Countries, Large Emerging Markets, and South-South Preferential Trade Agreements",10.7910/DVN/8EWBO9
Replication Data for: Nudging the Needle: Foreign Lobbies and US Human Rights Ratings,10.7910/DVN/RKMJNR
Replication Data for: The Political Economy of Financial Reform: de Jure Liberalization vs. de Facto Implementation,10.7910/DVN/OBRR7O
Replication Data for: Are the Contents of International Treaties Copied and Pasted? Evidence from Preferential Trade Agreements,10.7910/DVN/Q0N8Y0
"Replication Data for: Blue Helmets, Red Flags: Institutional, Societal, and Military Determinants of Peacekeeping Abuses",10.7910/DVN/RGIMXH
Replication Data for: Power Sharing and the Rule of Law in the Aftermath of Civil War,10.7910/DVN/LSAYBS
Replication Data for: The Risks of Election Observation: International Condemnation and Post-Election Violence,10.7910/DVN/XFQZI2
"Replication Data for: Competitive Intervention, Protracted Conflict, and the Global Prevalence of Civil War",10.7910/DVN/WQA7TS
"Replication Data for: Economic Crisis, Natural Resources, and Irregular Leader Removal in Autocracies",10.7910/DVN/TDTZHE
Replication Data for: Building Trust: The Effect of US Troop Deployments on Public Opinion in Peru,10.7910/DVN/1CBIQW
Replication Data for: Opinion-Formation and Issue-Framing Effects of Russian News in Kyrgyzstan,10.7910/DVN/DMBKBJ
"Replication Data for: One Dyadic Peace Leads to Another? Conflict Systems, Terminations, and Net Reduction in Fighting Groups",10.7910/DVN/PNI3YB
Replication Data for: Regulatory Convergence in the Financial Periphery: How Interdependence Shapes Regulators’ Decisions,10.7910/DVN/VBNPJS
Replication Data for: Boilerplate in International Trade Agreements,10.7910/DVN/VXDQKV
"Replication Data for: Electoral Rules, Interest Group Pressures, and the Price of Democratic Default",10.7910/DVN/WC7URM
Replication Data for: Do Self-Reporting Regimes Matter? Evidence from the Convention Against Torture,10.7910/DVN/XYJXU5
Replication Data for: Human Rights versus National Interests: Shifting US Public Attitudes on the International Criminal Court,10.7910/DVN/VHV4CO
Replication Data for: Promoting Compliance with Human Rights: The Performance of the United Nations’ Universal Periodic Review and Treaty Bodies,10.7910/DVN/LIMPMU
Replication Data for: Legitimacy and the Cognitive Sources of International Institutional Change: The Case of Regional Parliamentarization,10.7910/DVN/GCPM1D
Replication Data for: The Dark Side of Cooperation: International Organizations and Member Corruption,10.7910/DVN/0S5YSH
Replication Data for: How Do Prior Rulings Affect Future Disputes?,10.7910/DVN/D6OQUK
Replication Data for: Density and Decline in the Founding of International NGOs in the United States,10.7910/DVN/JJVUNZ
Replication Data for: The Causes and Effects of Leaks in International Negotiations,10.7910/DVN/YOBC8Z
Replication Data for: Destroying Trust in Government: Effects of a Broken Pact among Colombian Ex-Combatants,10.7910/DVN/20YVPN
Replication Data for: The Chilling Effect of International Investment Disputes: Limited Challenges to State Sovereignty,10.7910/DVN/BHNDHH
Replication Data for: The Limits of Collective Financial Statecraft: Regional Development Banks and Voting Alignment with the United States at the United Nations General Assembly,10.7910/DVN/P4EYHH
Replication Data for: Foreign Policy Preferences in Ukraine: Trade and Ethnolinguistic Identity,10.7910/DVN/KBSJOZ
Replication Data for: Settling Resistant Territorial Disputes: The Territorial Boundary Peace in Latin America,10.7910/DVN/L80DZI
Replication Data for: When States Crack Down on Human Rights Defenders,10.7910/DVN/EL7MH0
"Replication Data for: Human Rights on the March: Repression, Oppression, and Protest in Latin America",10.7910/DVN/2NNBF9
"Replication Data for: The Path of the Boomerang: Human Rights Campaigns, Third-Party Pressure, and Human Rights",10.7910/DVN/XT6RCE
Replication Data for: A Growing Queer Divide: The Divergence between Transnational Advocacy Networks and Foreign Aid in Diffusing LGBT Policies,10.7910/DVN/XINDPB
Replication Data for: Transnational Ties and Support for Foreign Aid,10.7910/DVN/S0VCUQ
Replication Data for: Heterogeneous Effects of Development Aid on Violent Unrest in Postwar Countries: Village-Level Evidence from Nepal,10.7910/DVN/1M5XOJ
Replication Data for: When Organizations Rebel: Introducing the Foundations of Rebel Group Emergence (FORGE) Dataset,10.7910/DVN/IIQEEM
"Replication Data for: Allegiance, Ability, and Achievement in the American Civil War: Commander Traits and Battlefield Military Effectiveness",10.7910/DVN/7PJPJ9
Replication Data for: The Relationship between Contributors’ Domestic Abuses and Peacekeeper Misconduct in United Nations Peacekeeping Operations,10.7910/DVN/CBNJB2
Replication Data for: Rebel Group Attrition and Reversion to Violence: Micro-Level Evidence from Syria,10.7910/DVN/P8VP8L
Replication Data for: Under the Roof of Rebels: Civilian Targeting After Territorial Takeover in Sierra Leone,10.7910/DVN/BEKPWV
Replication Data for: Who Wants to Be a Suicide Bomber? Evidence from Islamic State Recruits,10.7910/DVN/M8INWW
Replication Data for: Exporting Murder: US Deportations and the Spread of Violence,10.7910/DVN/YSAKX8
Replication Data for: Backlash and Judicial Restraint: Evidence from the European Court of Human Rights,10.7910/DVN/H39FCV
Replication Data for: Selling Out or Standing Firm? Explaining the Design of Civil War Peace Agreements,10.7910/DVN/2JKA7I
"Replication Data for: Thinking outside the Box: Globalization, Labor Rights, and the Making of Preferential Trade Agreements",10.7910/DVN/H3PQEX
Replication Data for: Trust and Support for Comprehensive Trade Agreements in the European Parliament,10.7910/DVN/JV5OPA
Replication Data for: Debt or Alive: Burundi's Fiscal Response to Economic Sanctions,10.7910/DVN/T9ZRHO
Replication Data for: Why is the Mass Public Not More Supportive of Free Trade? Evidence from the United States,10.7910/DVN/8PVLQM
Replication Data for: Bread Before Guns or Butter: Introducing Surplus Domestic Product,10.7910/DVN/BUOKNI
Replication Data for: Leaders and Default,10.7910/DVN/LVK5M9
Replication Data for: State Disengagement: Evidence from French West Africa,10.7910/DVN/FSJFKY
Replication Data for: Civil Conflict and Agenda-Setting Speed in the United Nations Security Council,10.7910/DVN/SXN5J6
Replication Data for: Illiberal Norm Diffusion: How Do Governments Learn to Restrict Nongovernmental Organizations?,10.7910/DVN/DCLRIT
"Replication Data for: Updating the Militarized Interstate Dispute Data: A Response to Gibler, Miller, and Little",10.7910/DVN/PRJNG9
"Replication Data for: The Importance of Correct Measurement: A Response to Palmer, et al",10.7910/DVN/6CWQNQ
Replication Data for: Do Walls Work? The Effectiveness of Border Barriers in Containing the Cross-Border Spread of Violent Militancy,10.7910/DVN/ISL3JV
Replication Data for: When Prospective Leader Turnover Promotes Peace,10.7910/DVN/KDPJUC
Replication Data for: The Micro-Foundations of the Resource Curse: Mineral Ownership and Local Economic Well-Being in Sub-Saharan Africa,10.7910/DVN/A4LII3
Replication Data for: Productive Pacifists: The Rise of Production-Oriented States and Decline of Profit-Motivated Conquest,10.7910/DVN/EASYOE
Replication Data for: The Domestic Impact of International Standards,10.7910/DVN/D17RVD
Replication Data for: Demanding Truth: The Global Transitional Justice Network and the Creation of Truth Commissions,10.7910/DVN/QCWXD8
Replication Data for: Why International Organizations Commit to Liberal Norms,10.7910/DVN/0ZPJNK
"Replication Data for: ""The Politics of Trade Adjustment vs. Trade Protection""",10.7910/DVN/LV2CAJ
"Replication Data for ""Strangers in Hostile Lands: Exposure to Refugees and Right-wing Support in Germany’s Eastern Regions""",10.7910/DVN/C6NONY
Replication Data for: The Representation Gap and Political Sophistication: A Contrarian Perspective,10.7910/DVN/NQ0F7P
Replication Data for: Self-Selection Into Public Service When Corruption is Widespread: The Anomalous Russian Case,10.7910/DVN/QEIICM
Replication Data for The Politics of Ethnic Identity in Sub-Saharan Africa,10.7910/DVN/J4EUVP
Replication Data for: Barking Up the Wrong Tree: How Political Alignment Shapes Electoral Backlash from Natural Disasters,10.7910/DVN/NDHS9Q
Corrigendum: Marginal Effects in Interaction Models: Determining and Controlling the False Positive Rate,10.7910/DVN/HEVGTW
Replication Data for Voter and Legislator Responses to Localized Trade Shocks from China in Brazil,10.7910/DVN/JIZ7I1
Replication Data for: Crisis and Convergence: How the Combination of a Weak Economy and Mainstream Party Ideological De-Polarisation Fuels Anti-System Support,10.7910/DVN/DFZFQ2
Replication Data for: Does Affirmative Action Work? Evaluating India's Quota System,10.7910/DVN/YWKZHJ
Replication Data for: Social Transformation and Violence: Evidence from U.S. Reconstruction,10.7910/DVN/CCHS9C
Replication Data for: From Benefits and Beneficiaries. The Historical Origins of Old Age Pensions from a Political Regime Perspective,10.7910/DVN/SVGIJV
Erosion of Civilian Control in Democracies: A Comprehensive Framework for Comparative Analysis,10.7910/DVN/BBCAYZ
Replication Data for: Shoring Up Autocracy: Participatory Technologies and Regime Support in Putin's Russia,10.7910/DVN/52HSIA
"Replication Data for Colonial Education, Political Elites, and Regional Political Inequality in Africa",10.7910/DVN/PX9A61
Replication Data for: Personal Proximity and Reactions to Terrorism,10.7910/DVN/F4GH3L
Replication Data for: Generous to Workers ≠ Generous to All - Implications of European Unemployment Benefit Systems for the Social Protection of Immigrants,10.7910/DVN/LKSG8A
Replication Data for: Parliamentary Representation and the Normalization of Radical Right Support,10.7910/DVN/Z6S26H
Replication Data for: The Long-Term Impact of Mobilization and Repression on Political Trust,10.7910/DVN/DCAKKT
Replication Data for: The Element of Surprise: Election Timing and Opposition Preparedness,10.7910/DVN/CWAOGP
Replication Data for: Competing for Loyalists? How Party Positioning Affects Populist Radical Right Voting,10.7910/DVN/BQDMAD
"Replication Data for: Immigration Threat, Partisanship and Democratic Citizenship: Evidence from the US, UK, and Germany",10.7910/DVN/RNCIMX
Replication Data for: Drinking Alone: Local Socio-Cultural Degradation and Radical Right Support—The case of British Pub Closures,10.7910/DVN/E0NUUX
Replication Data for: How Political Careers affect Prime-Ministerial Performance: Evidence from Central and Eastern Europe,10.7910/DVN/S3LP6O
"Replication Data for: Inequality, Exclusion, and Tolerance for Political Dissent in Latin America",10.7910/DVN/OSISYZ
"Replication Data for: Voting for Populism in Europe: Globalization, Technological Change, and the Extreme Right",10.7910/DVN/ZTEIKG
Replication Data for: Political institutions and coups in dictatorships,10.7910/DVN/J0FLAQ
Replication Data for: The Representational Effects of Communal Property,10.7910/DVN/M4ZWL8
Replication Data for “Equal Treatment and the Inelasticity of Tax Policy to Rising Inequality”,10.7910/DVN/BWCZKE
"Replication Data for: Team and Nation: Sports, Nationalism, and Attitudes toward Refugees",10.7910/DVN/XCSB9W
Replication Data for: Are Immigrant-Origin Candidates Penalized Due to Ingroup Favoritism or Outgroup Hostility?,10.7910/DVN/VXRL7A
"Replication Data for: Insiders, outsiders, skills and preferences for social protection: evidence from a survey experiment in Argentina",10.7910/DVN/Q0TUL2
"Replication Data for: How ‘Us’ and ‘Them’ Relates to Voting Behavior - Social Structure, Social Identities, and Electoral Choice",10.7910/DVN/NS6MYB
"Replication Data for: Policy-making in Multi-Level Systems:  Ideology, Authority, and Education",10.7910/DVN/ETFEMX
"Replication Data for: When Running for Office Runs in the Family: Horizontal Dynasties, Policy and Development in the Philippines",10.7910/DVN/WILS4Y
Replication Data for: Economic Distress and Support for Radical Right Parties – Evidence from Sweden,10.7910/DVN/MKU5V0
Replication Data for: Do Truth Commissions Improve Democracy?,10.7910/DVN/26TUJE
Replication Data for: Can conservatism make women more vulnerable to violence?,10.7910/DVN/YL8V4Y
Replication Data for: Violence and Business Interest in Social Welfare: Evidence from Mexico,10.7910/DVN/V9X6QG
Replication Data for: Party Competition and Cooperation Shape Affective Polarization: Evidence from Natural and Survey Experiments in Israel,10.7910/DVN/XCIXZB
Replication Data for: Protest Brokers and the Technology of Mobilization: Evidence from South Africa,10.7910/DVN/SP1UVH
Replication Data for: Strategic State Capacity: How States Counter Opposition to Climate Policy,10.7910/DVN/JURWVP
"Replication Data for ""Technological Risk and Policy Preferences""",10.7910/DVN/BED0LS
"Replication Data for: ""Ministerial Autonomy, Parliamentary Scrutiny and Government Reform Output in Parliamentary Democracies""",10.7910/DVN/14U9C2
"Replication Data for ""Why Physical Barriers Backfire: How Immigration Enforcement Deters Return and Increases Asylum Applications""",10.7910/DVN/VKM7QO
Replication Data for: Satisfaction with Democracy:  When Government by the People brings Electoral Losers and Winners Together,10.7910/DVN/XYKL6L
"Replication Data for: ""Which Jobs for Which Boys? Party Finance and the Politics of State Job Distribution in Africa""",10.7910/DVN/UV7EDQ
"Replication Data for: Reshaping the Threat Environment: Personalism, Coups, and Assassinations",10.7910/DVN/BB7F6Z
Replication Data for: When Marriage Gets Hard: Intra-Coalition Conflict and Electoral Accountability,10.7910/DVN/OFP3HG
"Replication Data for: Parliament, People, or Technocrats? Explaining Mass Public Preferences on Delegation of Policy Making Authority",10.7910/DVN/RFAXEY
International Incentives for Women's Rights in Dictatorships,10.7910/DVN/XFS42O
Replication Data for: Collective Decision Making and the Economic Vote,10.7910/DVN/9ZBLOU
Replication Data for: Early Statehood and Support for Autocratic Rule in Africa,10.7910/DVN/O6L4UX
Replication Data for: Political Budgetary Cycles in Autocratic Redistribution,10.7910/DVN/2HH5GL
Replication Data for: Effective Government and Evaluations of Democracy,10.7910/DVN/MOERTC
Replication Data for: At the Intersection of Gender and Class: How Were Newly Enfranchised Women Mobilized in Sweden?,10.7910/DVN/HKFPKD
"Replication Data for: Nationalism, class, and status: how nationalists use policy offers and group appeals to attract a new electorate",10.7910/DVN/TKQHYQ
"Replication Data for: Who Registers? Village Networks, Household Dynamics, and Voter Registration in Rural Uganda",10.7910/DVN/YEFRPC
Replication Data for: Policing in a Post-Conflict State: Evidence from Uganda,10.7910/DVN/LWHFRU
Replication Data for: How Soft Propaganda Persuades,10.7910/DVN/CO3TWJ
Replication Data for: (Un)Natural Disasters: Electoral Cycles in Disaster Relief,10.7910/DVN/MWT7YG
,NA/NA
Replication Data for: The Anti-Incumbent Effects of Conditional Cash Transfer Programs.,10.7910/DVN/TXQZ4Y
"Replication Data for: The Contributions of the Ombudsman to Human Rights in  Latin America, 1982–2011",10.7910/DVN/LQAGXI
Replication Data for: Clientelism and the Utility of the Left-Right Dimension in Latin America,10.7910/DVN/LBYTBQ
"Replication Data for ""Can Anyone Stop the President? Power Asymmetries and Term Limits  in Latin America, 1984–2015",10.7910/DVN/HGFWYO
"Replication Data for: The International Monetary Fund, Party System Institutionalization, and Protest in Latin America",10.7910/DVN/XGSH1Q
Conditional Cash Transfer Programs and Electoral Accountability: Evidence from Latin America,10.7910/DVN/7UVIFY
Replication Data for: Presidentas Rise: Consequences for Women in Cabinets?,10.7910/DVN/X3TNCW
"Replication Data for ""Malapportionment and Ideological Bias in Chilean Electoral Districts""",10.7910/DVN/7KMZ9W
Replication Data for: When War Adversaries Talk: The Experimental Effect of Engagement Rules on Post-Conflict Deliberationhis text with your study name as it appears in your journal article,10.7910/DVN/XCRGIK
Replication Data for: Chile’s 2015 Electoral Reform:  Changing the Rules of the Game,10.7910/DVN/TKBUIV
The Formation of Cabinet Coalitions in Presidential Systems  ,10.7910/DVN/TODMSS
"Replication Data for: Mandates, Geography, and Networks: Diffusion of Criminal Procedure Reform in Mexico",10.7910/DVN/8W0PXP
"Replication Data for: Is It Race, Class or Gender? The Sources of Perceived Discrimination in Brazil",10.7910/DVN/YSO4ND
Replication Data for: The Racialized Effects of Social Programs in Brazil,10.7910/DVN/M4LNCI
"Replication Data for ""Compulsory Voting and Income Inequality: Evidence for Lijphart's Proposition from Venezuela""",10.7910/DVN/PU6NFA
"Replication Data for ""Support for Coups in the Americas: Mass Norms and Democratization""",10.7910/DVN/P1UXI5
Replication Data for: Floating Voters and the Rise of New Left Parties: Electoral Volatility During Party System Transformation,10.7910/DVN/GV6TLT
"Local Economic Voting and the Agricultural Boom in Argentina, 2007-2015",10.7910/DVN/PQHGIJ
"Replication Data for: ""Who Shot the Bullets? Exposure to Violence and Attitudes Toward Peace: Evidence from the 2016 Colombian Referendum""",10.7910/DVN/PYQ7T0
Replication Data for: Government and Opposition in Legislative Speechmaking: Using Text-As-Data to Estimate Brazilian Political Parties Policy Positions,10.7910/DVN/HY1FFV
"""Paz sí, pero no así""? Voter Profiles and Attitudes Toward the 2016 Colombian Peace Agreement",10.7910/DVN/GJNY3C
Replication Data for: The Nearness of Youth: Spatial and Temporal Effects of Protests on Political Attitudes in Chile,10.7910/DVN/YQTLLO
Replication Data for: Constituency Effects and Legislative Dissent  Under Closed-List Proportional Representation,10.7910/DVN/LPTJY1
Replication Data for: Uruguay and Contemporary Theories of Wage Coordination: Origins and Stabilization of Segmented Neocorporatism (2005–2019),10.7910/DVN/RNTWBF
"Replication Data for: Will I Get COVID-19? Partisanship, Social Media Frames, and Perceptions of Health Risk in Brazil",10.7910/DVN/0GVFDK
Explaining New Patterns in Family Leave Policies in Latin America,10.7910/DVN/V6GY3U
Replication data for: The Myth of Entangling Alliances: Reassessing the Security Risks of U.S. Defense Pacts,10.7910/DVN/29669
Replication data for: Barriers to Entry: Who Builds Fortified Boundaries and Why?,10.7910/DVN/U16NEI
"Online appendix for ""Indignation, Ideologies, and Armed Mobilization: Civil War in Italy, 1943–45""",10.7910/DVN/CBED0J
Balancing in Neorealism,10.7910/DVN/LDDARY
"Supplementary Appendix and Replication Data for Krebs, Ronald R., and Roy Licklider, ""United They Fall: Why the International Community Should Not Promote Military Integration after Civil War,"" <i>International Security</i>, Vol. 40, No. 3 (Winter 2015/16), pp. 93–138..",10.7910/DVN/FFJISL
"Replication Data for ""Rebel Diplomacy in Civil War""",10.7910/DVN/39DFOI
"Technical Appendix for Stephen Biddle and Ivan Oelrich, ""Future Warfare in the Western Pacific: Chinese Antiaccess/ Area Denial, U.S. AirSea Battle, and Command of the Commons in East Asia,"" International Security, Vol. 41, No. 1 (Summer 2016), pp. 7–48.",10.7910/DVN/GK6PR2
"Appendix for Charles L. Glaser and Steve Fetter, ""Should the United States Reject MAD? Damage Limitation and U.S. Nuclear Strategy toward China,"" International Security, Vol. 41, No. 1 (Summer 2016), pp. 49–98",10.7910/DVN/SKJMLU
"Replication Data and Supplemental Materials for: Alexander B. Downes and Lindsey A. O'Rourke, ""You Can't Always Get What You Want: Why Foreign-Imposed Regime Change Seldom Improves Interstate Relations,"" International Security, Vol. 41, No. 2 (Fall 2016), pp. 43–89.",10.7910/DVN/7Y4TD8
"Appendix for Keir A. Lieber and Daryl G. Press, ""The New Era of Counterforce: Technological Change and the Future of Nuclear Deterrence,"" International Security, Vol. 41, No. 4 (Spring 2017), pp. 9–49.",10.7910/DVN/NKZJVT
"Appendix for Valerie M. Hudson and Hilary Matfess, ""In Plain Sight: The Neglected Linkage between Brideprice and Violent Conflict,"" International Security, Vol. 42, No. 1 (Summer 2017), pp. 7–40.",10.7910/DVN/5PZSJZ
"Appendix for Nicholas L. Miller, ""Why Nuclear Energy Programs Rarely Lead to Proliferation,"" International Security, Vol. 42, No. 2 (Fall 2017), pp. 40–77, doi:10.1162/ISEC_a_00293.",10.7910/DVN/8EMSFK
"Supplementary materials for Kai Quek and Alastair Iain Johnston, ""Can China Back Down? Crisis De-escalation in the Shadow of Popular Opposition,"" International Security, Vol. 42, No. 3 (Winter 2017/18), pp. 7–36, doi:10.1162/ISEC_a_00303.",10.7910/DVN/Y6FBSL
