file_in,title,journal,count_prereg,prereg_context,prereg_term_context
10.1007_s11109-015-9319-3,Turning out unlikely voters? {A} field experiment in the top-two primary,Political Behavior,4,"n investigate heterogeneous treatment effects, which we had pre-registered, as well as persistence into the november general election. the central result from our analysis is that these voters who would normally not be contacted by campaigns or election administrators because they hadn’t previously voted in primaries (‘‘low-propensity voters’’ in the parlance of campaigns) respond to simple informational letters to the same or even greater degree as citizens resp","7 we preregistered heterogeneous treatment effect analysis prior to receiving the results at http://e-gap. org, and also anticipated this analysis through the block randomization of our experimental design. we analyze heterogeneous treatment effects by two pre-registered district variables in a companion article. polit behav (2016) 38:413–432 425 123 in"
,,,,"hable difference with or without block fixed effects. 17 we preregistered heterogeneous treatment effect analysis prior to receiving the results at http://e-gap. org, and also anticipated this analysis through the block randomization of our experimental design. we analyze heterogeneous treatment effects by two pre-registered district variables in a companion article. polit behav (2016) 38:413–432 425 123 in fig. 3, we present heterogeneous treatment effects by g","undation, and did not involve deception of its subjects. we pre-registered our analysis with http://e-gap.org. the authors are solely responsible for interpretation, analysis, and conclusions. a replication archive is available at http:// dx.doi.org/10.7910/dvn/8qlbsa or from the authors on request. references arceneaux, k., & nickerson, d. w. (2009). w"
,,,,"l design. we analyze heterogeneous treatment effects by two pre-registered district variables in a companion article. polit behav (2016) 38:413–432 425 123 in fig. 3, we present heterogeneous treatment effects by groups of registrant age (the same age groupings used in our block randomization) and individual turnout history in recent general elections. we again include the overall effects to the far left for reference. there is some evidence that the letters were",
,,,,"undation, and did not involve deception of its subjects. we pre-registered our analysis with http://e-gap.org. the authors are solely responsible for interpretation, analysis, and conclusions. a replication archive is available at http:// dx.doi.org/10.7910/dvn/8qlbsa or from the authors on request. references arceneaux, k., & nickerson, d. w. (2009). who is mobilized to vote? a re-analysis of eleven randomized field experiments. american journal of political sci",
10.1007_s11109-013-9239-z,Do online advertisements increase political candidates' name recognition or favorability? {Evidence} from randomized field experiments,Political Behavior,1,"herwise. 16 best practices in randomized trials include the pre-registration of an analysis plan to limit researcher discretion (casey et al. 2012). 272 polit behav (2014) 36:263–289 123 politically meaningful impacts. indeed, the results cast doubt on the proposition that dozens of online ads increased the candidate’s name recognition in his district by more than approximately 1.8 % points, which marks the upper end of the 95 % confidence interval. because only "," the launch of the survey, in accordance with the authors’ ex ante analysis plan, registered at the egap website.16 finally, we present the results from regressions that control for blocks and form confidence intervals using clustered standard errors and an assumed normal sampling distribution. across four dependent variables, the results of the experi"
,,,,,"exclude them from the analysis below in keeping with the cautious procedure laid out in our ex ante pre-analysis plan. results: descriptive statistics descriptive statistics for the 3,557 voters who both completed the poll and were matched back to the voter file are shown in table 3. reassuringly, 24 % of the sample had been assigned to be treated with ads, es"
,,,,,", k., glennerster, r., & miguel, e. (2012). reshaping institutions: evidence on aid impacts using a pre-analysis plan. quarterly journal of economics, 127(4), 1755–1812. chong, d., & druckman, j. n. (2010). dynamic public opinion: communication effects over time. american political science review, 104(4), 663–680. danaher, p. j., & mullarkey, g. w. (2003). fac"
10.1007_s11109-015-9305-9,The rich are different: the effect of wealth on partisanship,Political Behavior,1,"vote in a primary for the other party. this might mean that pre-registered winners also changed their partisan identification in response to winning, but they never take the formal step to change their party registration. while not particularly costly, changing partisan registration in pennsylvania would require voters to change during a visit to the department of motor vehicles or mail a form to their county board of elections. the data on the subsequent politic",
10.1007_s11109-016-9350-z,Reprecincting and voting behavior,Political Behavior,1,"on. furthermore, florida allows for 16- and 17-year-olds to pre-register to vote; those who had not yet turned 18 by the 2012 election were also excluded. 8 on this point, our research design differs from haspel and knotts (2005: 536), who report using a single voter file obtained by the georgia secretary to determine a voter’s residence, election day polling location, and turnout in the 2001 atlanta election. because they use a single snapshot from the voter fil",
10.1007_s11109-017-9413-9,What draws politicians' attention? {An} experimental study of issue framing and its effect on individual political elites,Political Behavior,1,"signing the experiments. they were, however, not officially pre-registered. polit behav (2018) 40:547–569 551 123 whether conflict is equally attractive for elites as it is for citizens. on the one hand, as elites are more purposeful and rational information users, we may expect them to be less sensitive to news framing in general. on the other hand, as politics essentially is about conflicts we may expect politicians to be especially attentive to bits of informa",
10.1007_s11109-018-9491-3,Anxious voters in the 2016 u.s. {Election}: an analysis of how they decided from the erpc2016,Political Behavior,17,"tudy’s release. in so doing, it serves as a model for other preregistered and potentially pre- accepted research. consistent with past findings, this study shows that anxious vot- ers in 2016 were less likely to rely on past partisanship and more likely to base deci- sions on personal qualities. however, anxiety did not condition the effect of issues in the election. further, donald trump faced no more anxiety among republican voters than mitt romney did in 2012","by, dave peterson, and keith t. poole. the preregistered research design is available at http://www.osf.io/34cfg​/regis​ter/57ace​80a59​4d900​ 00154​03c6. complete replication information is available at https​://doi.org/10.7910/dvn/s2vgj​1. previous versions of this project were presented at the political studies association’s 2017 political methodol"
,,,,"ty served as unique features of the 2016 election. keywords preregistration · voting behavior · elections · political psychology · bayesian statistics for helpful research assistance, i thank ryan bakker, arthur lupia, brendan nyhan, andreas murr, ken benoit, michael breen, donnacha ó beacháin, bill jacoby, dave peterson, and keith t. poole. the preregistered research design is available at http://www.osf.io/34cfg​/regis​ter/57ace​80a59​4d900​ 00154​03c6. comple","aiken 1987; petty and cacioppo 1981; petty and cacioppo 3 full details are available here: https​://osf.io/34cfg​/regis​ter/57ace​80a59​4d900​00154​03c6. 4 for more information, see: http://www.erpc2​016.com/. 5 the originally reported version of the 2012 model actually had a coding error in it due to a mistake in specifying a boolean statement. hence"
,,,,"acháin, bill jacoby, dave peterson, and keith t. poole. the preregistered research design is available at http://www.osf.io/34cfg​/regis​ter/57ace​80a59​4d900​ 00154​03c6. complete replication information is available at https​://doi.org/10.7910/dvn/s2vgj​1. previous versions of this project were presented at the political studies association’s 2017 political methodology group conference in oxford, england, the department of methodology at the london school of e",", k., glennerster, r., & miguel, e. (2012). reshaping institutions: evidence on aid impacts using a preanalysis plan. quarterly journal of economics, 127(4), 1755–1812. chaiken, s. (1987). the heuristic model of persuasion. in m. p. zanna, j. m. olson, & c. p. herman (eds.), social influence: the ontario symposium (vol. 5, pp. 3–39). hillsdale, nj: lawrence e"
,,,,"a registered report that studies electoral behavior using a prereg- istered design. that is, before votes were counted in the 2016 election, i publicly released my plan for assessing how anxiety conditioned voters’ decisions with the 1 based on abc news/washington post polls over more than 30 years, as reported by usa today. 2 figure a.5 in the online appendix shows results for the model presented in this paper, repeated for each presidential election from 1984-",
,,,,"litical behavior (2020) 42:189–212 open science framework.3 preregistering a study before observing the outcome variable is increasingly popular and raises honesty and transparency in research (asendorpf et al. 2013; casey et al. 2012; chambers 2013; humphreys et al. 2013; king et al. 2007; monogan 2013; monogan 2015). this article was written as part of the 2016 election research preacceptance competition (erpc2016), which chal- lenged authors to write their pa",
,,,,"rsion exactly fits the substantive specifi- cation from the preregistration. this illustrates how human errors can be addressed in registered reports. 192 political behavior (2020) 42:189–212 1 3 1986b, a). these dual-process models of information processing maintain that humans use both an explicit and an implicit form of reasoning, the former requir- ing much more cognitive energy. to preserve energy, humans normally rely on the implicit form of reasoning and ",
,,,,"possible. in contrast to past work, however, this article’s preregistered design specified ahead of time that it would utilize the panel structure of the anes. this study measures all predictors in the pre-election wave, but measures the dependent variable of reported vote choice in the post-election wave. so while certain observable variables may have feedback loops, the time ordering is correct for affective intelligence theory because it is impossible for res",
,,,," pride had heightened towards trump. turning to testing the preregistered hypotheses of interest, table 3 summarizes the findings from estimating the model from eq. (1) over the 2012 anes data. the first eight numeric rows present marginal posterior summaries of the coefficients 15 in the online appendix, table a.7 presents an alternate version of the 2016 model that excludes dis- gust, for the sake of comparability with the 2012 model. the results of appendix t",
,,,," and maxi- mum levels of anxiety—which is actually what the preregistered design calls for. the preregistered ver- sions are online because the wider spread in anxiety reduces credible interval overlap, making the color- required figures easier to read. 204 political behavior (2020) 42:189–212 1 3 this effect differs noticeably when moving from one level of anxiety to another. the red dashed line for low-anxiety voters is the steepest and shows the greatest sepa",
,,,,"ch is actually what the preregistered design calls for. the preregistered ver- sions are online because the wider spread in anxiety reduces credible interval overlap, making the color- required figures easier to read. 204 political behavior (2020) 42:189–212 1 3 this effect differs noticeably when moving from one level of anxiety to another. the red dashed line for low-anxiety voters is the steepest and shows the greatest separa- tion of vote choice among partis",
,,,,"test model, this section now turns to the true tests of the preregistered hypotheses using the 2016 anes data. table 4 reports the same model for the 2016 election, with the addition of disgusted as a fifth measure of can- didate emotion. just as in 2012, the first three numeric columns of this table report the main effects for partisanship, issue proximity, and candidate qualities. again in 0.0 0.2 0.4 0.6 0.8 1.0 0.0 0.2 0.4 0.6 0.8 1.0 partisanship−−higher va",
,,,,"tive model of vote choice. all of this was completed with a preregistered design that was developed before the votes were counted in the 2016 election with a regis- tered report that was reviewed before the 2016 anes data were released. 209 1 3 political behavior (2020) 42:189–212 for readers interested in how a registered report works as part of the traditional review process, i first point to the online appendix for examples of robustness checks and even addit",
,,,," affect behavior. how- ever, because it was not part of the preregistered design readers can note that it was not theoretically anticipated by the author—rather something that was learned from data. this distinction between hypothesis testing and reporting based on empirical observations and suggested ideas is worthwhile as future political behavior research determines how to further examine the role of emotions in politics. additionally, a software error from t",
,,,,"otions in politics. additionally, a software error from the preregistered design is reported for full disclosure in the appendix, so that shows how human errors can be transparently presented in cases like this. overall, this study and others from the erpc2016 should serve to show how a registered report can fit into academic journals. researchers are encouraged to give preregistration a try in a study to see how it works in practice for themselves. besides the ",
,,,," into academic journals. researchers are encouraged to give preregistration a try in a study to see how it works in practice for themselves. besides the intriguing side point that anxiety can reduce turnout, the tests of the preregistered hypotheses are informative. to start, the results from 2016 mostly fit with the expectations of affective intelligence theory (and the 2012 results exactly fit with the theoretical expectations). in 2016, we saw that voters who",
,,,,"ide point that anxiety can reduce turnout, the tests of the preregistered hypotheses are informative. to start, the results from 2016 mostly fit with the expectations of affective intelligence theory (and the 2012 results exactly fit with the theoretical expectations). in 2016, we saw that voters who were anx- ious about the candidate from their own party were less likely to rely strictly on the normal vote that their partisanship would imply. that is, anxious v",
,,,,"nalysis, 21(1), 21–37. monogan, j. e, iii. (2015). research preregistration in political science: the case, counterarguments, and a response to critiques. political science and politics, 48(3), 425–429. 212 political behavior (2020) 42:189–212 1 3 mutz, d. c. (1998). impersonal influence: how perceptions of mass collectives affect political attitudes. new york: cambridge university press. neuman, w. r. (1981). differentiation and integration: two dimensions of p",
10.1007_s11109-018-9499-8,Self-awareness of political knowledge,Political Behavior,1,"he study (2000020387). an overview of the analytic plan was pre-registered in the evidence in governance and politics repository (20170629aa). a replication file is available at dataverse.harvard. edu/dataverse/polbehavior. references ahler, d. j., & sood, g. (2018). the parties in our heads: misperceptions about party composition and their consequences. the journal of politics, 80(3), 694–981. alvarez, r. m., & franklin, c. h. (1994). uncertainty and political p",
10.1007_s11109-019-09534-z,Do means of program delivery and distributional consequences affect policy support? {Experimental} evidence about the sources of citizens' policy opinions,Political Behavior,1,"ted on mturk was intended as a pilot study, thus we did not pre-register a plan for analysis. 1114 political behavior (2020) 42:1097–1118 1 3 p < 0.05). this effect in the mturk sample is approximately 15% of the standard deviation of responses in the direct treatment. while the respondents in both sam- ples appear to prefer the indirect framing of the hmid, the difference in the mag- nitude of results leads us to be cautious in characterizing citizens preference", proce- dures we follow in our analyses were decided and documented prior to data collec- tion in a pre-analysis plan.13 survey respondents are asked about two hypothetical prospective policies: a pro- gram that provides newborns and their mothers with nutritional assistance (nutri- tion policy) and a program that helps employed workers get additional training
,,,,,ed in experiment 2) reflect decisions made prior to data collection and that were documented in two pre-analysis plans registered with evidence in governance and politics (egap). the pre-analysis plans are filed jointly under egap id 20170725aa. materials to replicate the analyses presented in this article are available here: https​://doi.org/10.7910/ dvn/xyya
,,,,,that were documented in two pre-analysis plans registered with evidence in governance and politics (egap). the pre-analysis plans are filed jointly under egap id 20170725aa. materials to replicate the analyses presented in this article are available here: https​://doi.org/10.7910/ dvn/xyyaq​c. 14 wic is a federally funded program that targets low-incom
,,,,,ocumented in two pre-analysis plans registered with evidence in governance and politics (egap). the pre-analysis plans are filed jointly under egap id 20170725aa. materials to replicate the analyses presented in this article are available here: https​://doi.org/10.7910/ dvn/xyyaq​c. 14 wic is a federally funded program that targets low-income pregnant and post
,,,,,"red with evidence in governance and politics (egap). the pre-analysis plans are filed jointly under egap id 20170725aa. materials to replicate the analyses presented in this article are available here: https​://doi.org/10.7910/ dvn/xyyaq​c. 14 wic is a federally funded program that targets low-income pregnant and postpartum women, infants, and children"
,,,,,"s. details regarding the procedure we use were decided and documented prior to data collection in a pre-analysis plan 1107 1 3 political behavior (2020) 42:1097–1118 indirect transfers as less costly to the government, relative to direct transfers (nutri- tion: difference-of-means, ̂ pate = −0.47 in decreased cost, p < 0.01; job train- ing: difference-of-means"
,,,,,"s. details regarding the procedure we use were decided and documented prior to data collection in a pre-analysis plan 1112 political behavior (2020) 42:1097–1118 1 3 after learning about the distributional consequences of both policies, respondents may want to modify how much different income-groups benefit. we find sugges- tive evidence of this in the case of"
10.1007_s11109-019-09550-z,Exposure to immigration and admission preferences: evidence from france,Political Behavior,1,"mmigrants with particular characteris- tics. we conducted a pre-registered conjoint experiment in france in the aftermath of the 2017 french presidential election, and asked respondents to choose between hypothetical immigrants for admission. given the prominence of immigration rheto- ric in the campaign (kettley 2017; nossiter 2017), france’s historically unitarist, universalist, and secular understanding of nationhood and citizenship (brubaker 1992), the presen",
10.1007_s11558-017-9281-4,Who matters for memory: sources of institutional memory in international organization crisis management,The Review of International Organizations,1," subject ethics committee. the irb registration constitutes pre-registration of the experiment. 458 h. hardt military staff. (for this study, i did not receive funding or privileged access, and i was not employed by nato.) first, this study demonstrated that the us has an unexpected way of influencing io elite behavior. nato elites were found to be less likely to pass on knowledge when the us government reported the error. i argue that this effect is due to elite",
10.1007_s11558-017-9293-0,The first image reversed: igo signals and mass political attitudes,The Review of International Organizations,1,"university of colorado at boulder on february 25, 2016. our pre-registration for this study can be found at https://osf.io/ek4zx/. the first image reversed: igo signals and mass political attitudes 601 the experimental treatment in each scenario is the randomized exposure to an igo signal. in the economic scenario, the signal concerns a report from the world trade organization (wto) about the government’s (non)compliance with its free trade rules. in the conflict","lorado at boulder on february 25, 2016. our pre-registration for this study can be found at https://osf.io/ek4zx/. the first image reversed: igo signals and mass political attitudes 601 the experimental treatment in each scenario is the randomized exposure to an igo signal. in the economic scenario, the signal concerns a report from the world trade or"
10.1007_s11558-018-9305-8,Opening hours of polling stations and voter turnout: evidence from a natural experiment,The Review of International Organizations,2,"; hoffman et al. 2017). easy voter registration procedures, pre-registration laws, day-of-polling registration, postal voting, prepaid postage, and increasing the number of polling stations have also been shown to increase voter turnout (highton 1997, besley and case 2003, luechinger et al. 2007, funk 2010, brady and mcnulty 2011, bhatti 2012, gibson et al. 2013, burden et al. 2014, hodler et al. 2015, holbein and hillygus 2016, schelker and schneiter 2017).1 ano",
,,,," hillygus, d. s. (2016). making young voters: the impact of preregistration on youth turnout. american journal of political science, 60, 364–382. huber, p. j. (1967). the behavior of maximum likelihood estimates under nonstandard conditions. proceedings of the fifth berkeley symposium on mathematical statistics and probability, p 221–233. hsiang, s. m. (2010). temperatures and cyclones strongly associated with economic production in the caribbean and central ame",
10.1007_s11558-018-9331-6,The elusive sources of legitimacy beliefs: civil society views of international election observers,The Review of International Organizations,1,"nd zürn 2019). to test our ideas, we used a series of three pre-registered survey experiments involving real and hypothetical international election monitoring organizations.4 we invited hundreds of ngos based all over the world, in their roles as representatives of civil society, to share their evaluations of international election observation groups that could be invited to future elections in their country. we randomly varied informational treatments about cha","ed and later seen by the electoral observation groups. 4 we registered the experimental designs and pre-analysis plans here: http://egap.org/design-registrations, numbers 20151112ab and 20160224aa. the elusive sources of legitimacy beliefs: civil society views of... 687 our focus on international election monitoring organizations as a case enables us to extend"
,,,,,"al observation groups. 4 we registered the experimental designs and pre-analysis plans here: http://egap.org/design-registrations, numbers 20151112ab and 20160224aa. the elusive sources of legitimacy beliefs: civil society views of... 687 our focus on international election monitoring organizations as a case enables us to extend the study of legitimacy"
,,,,,"ganization the elusive sources of legitimacy beliefs: civil society views of... 705 as noted in the pre-analysis plan, the experiment was well-powered, so we emphasize that these null results are precisely estimated. the 95% confidence intervals for the differences suggest that votes might be roughly 1.5 points higher or lower (on the 100-point scale with the "
10.1007_s11558-020-09401-1,"Foreign aid, oil revenues, and political accountability: evidence from six experiments in ghana and uganda",The Review of International Organizations,2,"iled prior to researcher access to the 2014 survey data, we pre-registered the following hypothesis: hypothesis 1 compared to oil funds, revenue from foreign aid will produce greater demands for accountability from citizens on government leaders. 3heinrich and loftis (2019) remain a rare exception by focusing on anti-incumbency economic voting. 4see martin (2014). “taxation, loss aversion, and accountability: theory and experimental evidence for taxation’s effect","citizens might expect greater benefits from aid due to its perceived lower corruption, in the first pre-analysis plan filed prior to researcher access to the 2014 survey data, we pre-registered the following hypothesis: hypothesis 1 compared to oil funds, revenue from foreign aid will produce greater demands for accountability from citizens on government leade"
