file_in,title,journal,count_prereg,prereg_context,prereg_term_context
,,,,"al journals now acknowledge open-research practices such as preregistration by placing badges on publications; editors could adopt this practice. another journal option would be to publish special issues on topics that can be studied easily with preregis- tered designs, such as elections, policy studies, and experimental research. for the special issue, only those studies with a prereg- istered design in a journal-approved forum would be considered. editors coul",
,,,,"sh special issues on topics that can be studied easily with preregis- tered designs, such as elections, policy studies, and experimental research. for the special issue, only those studies with a prereg- istered design in a journal-approved forum would be considered. editors could give authors the option of submitting a research design before the outcome variable is observed, which would allow pre-acceptance of an article before seeing the results—provided the r",
,,,," research. for the special issue, only those studies with a prereg- istered design in a journal-approved forum would be considered. editors could give authors the option of submitting a research design before the outcome variable is observed, which would allow pre-acceptance of an article before seeing the results—provided the research design is followed precisely. the issues could be guest-edited if journal editors preferred not to develop a two-track system. f",
,,,," to develop a two-track system. for journals that implement preregistration procedures, the online appendix accompanying this article lists several proto- registries that editors can rely on as hosts for public posting of research designs. if single-blind review is permissible, authors can easily include registration information from a proto-registry in the manuscript. to include registration information under double-blind review, some third-party registries all",
,,,,"itics, was subject to double-blind review; as such, blinded preregistration materials were shared with reviewers. (editors had access to the non-anonymous materials.) at present, editors and reviewers must assess adherence to the original research design; however, there are proposals to create a sustainable general registry with staﬀ who could verify the degree of compliance. creating a more comprehensive registry would be a major step forward for transparency i",
,,,,"ould assess whether the broader discipline would buy into a preregistration regime by giving the opportunity for ground-up acceptance of a new paradigm. to that end, the real debate will emerge when more political scientists use firsthand experience to evaluate study registra- tion in practice. for those considering self-registration of their research, it is worth considering that preregistration is more beneficial to readers under certain conditions than in oth",
,,,,"egistration of their research, it is worth considering that preregistration is more beneficial to readers under certain conditions than in others. a few cases in which registration would be less useful include theory-building projects, whether positive or normative. they would be diﬃcult to register because authors could not guarantee that they had not already worked on developing the argument. studies using big data oftenwill not gain substantially from regis- ",
,,,,clear oppor- tunity to oﬀer more transparency to readers by preregistering. in deductive studies that test one or a few hypotheses using original ps • july 2015 429 .............................................................................................................................................................................................................................................................................................................,
,,,,"l or economic treatments are all substantive areas in which preregistration has high value. in fact, the article titled “the 2011 debt ceiling controversy and the 2012 us house elections” in this issue demonstrates how regis- tration can be implemented in an election study. particularly in these cases, preregistering a study in practice is helpful for applied researchers to understand the process and develop an informed opinion. the registries in the appendix to",
,,,,"lemented in an election study. particularly in these cases, preregistering a study in practice is helpful for applied researchers to understand the process and develop an informed opinion. the registries in the appendix to this article provide tools that are available for authors to use, and several studies provide examples of self-registration in practice (casey, glennerster, and miguel 2012; humphreys, de la sierra, and van der windt 2013; king et al. 2007; mo",
,,,,"ptiveness to the self-initiative from authors for including preregistered research in journals. a greater number of printed preregistered studies will provide our discipline with a broader view of the tradeoﬀs in this step in transparency. supplementary material toview supplementary material for this article, pleasevisit http:// dx.doi.org/s1049096515000189. acknowledgments for helpful assistance, i thank phillip j. ardoin, jamie l. carson, keith l. dougherty, k",
,,,,"egistered research in journals. a greater number of printed preregistered studies will provide our discipline with a broader view of the tradeoﬀs in this step in transparency. supplementary material toview supplementary material for this article, pleasevisit http:// dx.doi.org/s1049096515000189. acknowledgments for helpful assistance, i thank phillip j. ardoin, jamie l. carson, keith l. dougherty, kevin m. esterling, n. macartan humphreys, anthony j. madonna, pa",
,,,,"dingthingsout. newyork: basic books. gelman, andrew. 2013. “preregistration of studies and mock reports.” political analysis 21 (1): 40–1. gerber, alan s., and neil malhotra. 2008. “do statistical reporting standards aﬀect what is published? publication bias in two leading political science journals.” quarterly journal of political science 3 (3): 313–26. gerber, alan s., neil malhotra, conor m. dowling, and david doherty. 2010. “publication bias in two political",
10.1017_s1049096515000463,Increasing the credibility of political science research: a proposal for journal reforms,PS: Political Science \& Politics,8,"erns about publication bias and replication failures is the preregistration of experimental trials—a practice that is mandated in some areas of medicine and is beginning to happen voluntarily by social science researchers conducting field experiments (particularly in development economics) or study- ing unobserved or uncollected observational data (e.g., grossman and pierskalla n.d.; monogan 2013). an emerging cross-disciplinary movement of researchers argues fo"," is a member of an ad hoc committee promoting the use of the registered reports format (see https://osf.io/8mpji). 6. a potential variant on this design is to include exploratory results as part of the first-round submission and then have a confirmatory analysis that is handled under the prespecification guidelines discussed herein. alternatively, jou"
,,,,"rging cross-disciplinary movement of researchers argues for preregistration because it forces authors to publicly disclose their hypotheses and analy- sis plans before data have been collected, which should reduce the risk of spurious results (e.g., gerber and malhotra 2008a; humphreys, de la sierra, and van der windt 2013; miguel et al. 2014; monogan 2013; wagenmakers et al. 2012). one of the best examples of this practice to date is the oregon health insur- an","el glennerster, and edward miguel. 2012. “reshaping insti- tutions: evidence on aid impacts using a preanalysis plan.” quarterly journal of economics 127 (4): 1755–812. ceci, stephen j., and wendy m. williams. 2011. “understanding current causes of women’s underrepresentation in science.” proceedings of the nationalacademy of sciences 108 (8): 3157–62. chambe"
,,,,"t non- binding registration for experiments. unfortunately, preregistration alone will not solve the prob- lem of publication bias. the format limits authors’ ability to produce the statistically significant findings that reviewers and editors demand, which may lead authors to opt out of registration or to shelve nonsignificant findings. as a result, authors have little incentive to engage in the practice unless it offers an appealing route to publication in pre",
,,,,"ls.3 in addition, schol- ars may be tempted to deviate from preregistered analysis plans when those plans are not linked to journal publication prac- tices. most fundamental, however, if studies are more apt to be 		 ps • special issue 2015 79 ..............................................................................................................................................................................................................................",
,,,,"s, then publication bias is still likely to ensue even when preregistration is commonly practiced, as studies frequently have found in exam- ining results from clinical trials (see, e.g., dwan et al. 2013).4 a better practice would be for journals to offer authors an option in which articles with prespecified analysis plans would be accepted in principle before the study was conducted. by offering this voluntary option of planned confirmatory studies, journals w",
,,,,"ory studies, journals would create a positive incentive for preregistration that would minimize file-drawer bias and avoid the mandates and constraints towhich some scholars object (e.g., laitin 2013; publications plan- ning ad hoc committee 2014). although this approach, which is known as registered reports, may seem radical, the format is currently being offered by a number of journals, including aims neuroscience (chambers et al. 2014), cortex (chambers 2013)",
,,,,"oncerns about publication bias and increased enthusiasm for preregistration and replication, the incentives for change in current research practices remain weak. unless lead- ing journals such as the apsr take steps like those i describe to address publication bias, the status quo is likely to remain in place. similarly, due to a lack of institutional changes, concerns about reviewer burdens and long lag times before publication have persisted for years without ",
,,,," of publications might change under a voluntary, nonbinding preregistration scheme. 5. full disclosure: the author is a member of an ad hoc committee promoting the use of the registered reports format (see https://osf.io/8mpji). 6. a potential variant on this design is to include exploratory results as part of the first-round submission and then have a confirmatory analysis that is handled under the prespecification guidelines discussed herein. alternatively, jo",
10.1017_s1049096516000810,Standard operating procedures: a safety net for pre-analysis plans,PS: Political Science \& Politics,10,"important trend has been a growing interest in, and use of, preregistration of experimental research designs, including detailed pre-analysis plans. investigators who ﬁle preregistered designs and pre-analysis plans commit themselves to stating their hypotheses ex ante, preventing “harking” and clarifying the distinction between conﬁrmatory and exploratory research. they also commit themselves to presenting the results of analysis methods that are preferred for "," editor, journalof experimental political science “s tandard operating procedures: a safety net for pre-analysis plans” addresses an issue of the highest importance in experimental political sci- ence. in this foreword, i provide a journal editor’s perspective on why this piece is likely to have a significant impact on the way in which future research is carri"
,,,,"ncluding detailed pre-analysis plans. investigators who ﬁle preregistered designs and pre-analysis plans commit themselves to stating their hypotheses ex ante, preventing “harking” and clarifying the distinction between conﬁrmatory and exploratory research. they also commit themselves to presenting the results of analysis methods that are preferred for ex ante theoretical reasons, limiting the ability of researchers to “ﬁsh” (consciously or unconsciously) for th","owing interest in, and use of, preregistration of experimental research designs, including detailed pre-analysis plans. investigators who ﬁle preregistered designs and pre-analysis plans commit themselves to stating their hypotheses ex ante, preventing “harking” and clarifying the distinction between conﬁrmatory and exploratory research. they also commit thems"
,,,,"pear (in a biased manner) more striking ex post. the use of preregistered designs and pre-analysis plans has been growing, and will doubtless continue to grow even more quickly over the next few years. around 20 academic journals in the human behavioral sciences, particularly in psychology and neuroscience, have taken the fur- ther step of opening a “registered reports” submission track, whereby research is accepted “in principle” for publication upon peer revie","rch designs, including detailed pre-analysis plans. investigators who ﬁle preregistered designs and pre-analysis plans commit themselves to stating their hypotheses ex ante, preventing “harking” and clarifying the distinction between conﬁrmatory and exploratory research. they also commit themselves to presenting the results of analysis methods that are preferr"
,,,,"n principle” for publication upon peer review of a detailed preregistered research design and pre-analysis plan, before data collection has taken place. this reform addresses pub- lication bias, and commits both journal editors and authors to publish the results of well-designed and theoretically important research, regardless of whether these results are statistically significant. within political science, comparative political studies has led the way, using re","eir results appear (in a biased manner) more striking ex post. the use of preregistered designs and pre-analysis plans has been growing, and will doubtless continue to grow even more quickly over the next few years. around 20 academic journals in the human behavioral sciences, particularly in psychology and neuroscience, have taken the fur- ther step of openin"
,,,,"itical science for the first time later in 2016. the use of preregistration and pre-analysis plans sounds sim- ple in the abstract. but in practice, researchers may not anticipate certain pitfalls that will occur when the research is actually imple- mented and the relevant data collected. through no fault of their own, researchers may find themselves in situations where they face the challenge of analyzing data that was generated through a process not exactly co","ted “in principle” for publication upon peer review of a detailed preregistered research design and pre-analysis plan, before data collection has taken place. this reform addresses pub- lication bias, and commits both journal editors and authors to publish the results of well-designed and theoretically important research, regardless of whether these results ar"
,,,,"erated through a process not exactly corresponding to their preregistered design, and which as a result cannot sensibly be analyzed exactly according to the corresponding pre-analysis plan.to the extent that research- ers then deal with the necessary deviations from preregistered procedures in an ad hoc manner, we are in a certain respect back where we started in the first place (though, of course, in not such a severe position)—researchers’ discretion in method","itical science, i will be bringing a the profession standard operating procedures: a safety net for pre-analysis plans winston lin, columbia university donald p. green, columbia university abstract across the social sciences, growing concerns about research transparency have led to calls for pre-analysis plans (paps) that specify in advance how researchers int"
,,,," research- ers then deal with the necessary deviations from preregistered procedures in an ad hoc manner, we are in a certain respect back where we started in the first place (though, of course, in not such a severe position)—researchers’ discretion in methods of analy- sis means the possibility of conscious or unconscious “fishing,” and means that submitted and published research will be biased accordingly. this article’s key insight is that, by precommitting t","ract across the social sciences, growing concerns about research transparency have led to calls for pre-analysis plans (paps) that specify in advance how researchers intend to analyze the data they are about to gather. paps promote transparency and credibility by helping readers distinguish between exploratory and conﬁrmatory analyses. however, paps are time-c"
,,,,"e presence of sops reduces the cost of preparing a detailed preregistered design / pre-analysis plan, thus increasing the likelihood that researchers will use these important tools in the ﬁrst place. this is so because certain oﬀ-the-shelf or previously settled protocols will be one-time “ﬁxed costs” (not even necessarily borne by the researcher, if she adopts a publicly circulat- ing set of sops) rather than “marginal costs” associated with every research proje","mission track to political science for the first time later in 2016. the use of preregistration and pre-analysis plans sounds sim- ple in the abstract. but in practice, researchers may not anticipate certain pitfalls that will occur when the research is actually imple- mented and the relevant data collected. through no fault of their own, researchers may find "
,,,,"in the same registry as the pap. if an analysis follows the pre-registered pap and sop, it is clearly pre-specified. if it is guided by later amendments to the sop, it falls into what humphreys, sanchez de la sierra, and van der windt (2013, 18) call “a gray zone in which analy- sis may stay true to the intent of the registered design but the defense of the details of implementation must be provided ex post rather than ex ante.”3 pre-specified, gray-zone, and exp","ed design, and which as a result cannot sensibly be analyzed exactly according to the corresponding pre-analysis plan.to the extent that research- ers then deal with the necessary deviations from preregistered procedures in an ad hoc manner, we are in a certain respect back where we started in the first place (though, of course, in not such a severe position)—"
,,,,"ons.” politicalanalysis 21 (1): 21–37. ———. 2015. “research preregistration in political science: the case, counterarguments, and a response tocritiques.” ps:politicalscienceandpolitics 48 (03): 425–429. nosek, b. a., g. alter, g. c. banks, d. borsboom, s. d. bowman, s. j. breckler, s. buck, c. d. chambers, g. chin, g. christensen, m. contestabile, a. dafoe, e. eich, j. freese, r.glennerster, d.goroﬀ, d. p.green, b. hesse, m. humphreys, j. ishiyama, d. karlan, a","t one. second, the presence of sops reduces the cost of preparing a detailed preregistered design / pre-analysis plan, thus increasing the likelihood that researchers will use these important tools in the ﬁrst place. this is so because certain oﬀ-the-shelf or previously settled protocols will be one-time “ﬁxed costs” (not even necessarily borne by the research"
,,,,,"esearch (miguel et al. 2014; nosek et al. 2015). one recent inno- vation is the public archiving of pre-analysis plans (paps) that specify details of the analysis (e.g., statistical methods, sample exclusions, outcome measures, covariates, and subgroup defi- nitions) before the researchers see unblinded outcome data.1 deviations from the plans are not prohibit"
,,,,,"chel glennerster, and edward miguel. 2012. “reshaping institutions: evidence on aid impacts using a preanalysis plan.” quarterly journal of economics 127 (4): 1755–1812. chambers, christopher d., eva feredoes, suresh d. muthukumaraswamy, and peter j. etchells. 2014. “instead of ‘playing the game’ it is time to change the rules: registered reports at aimsneuro"
,,,,,"don green’s lab at columbia.” https://github.com/acoppock/ green-lab-sop. mckenzie, david. 2012. “a pre-analysis plan checklist.” world bank. http://blogs. worldbank.org/impactevaluations/a-pre-analysis-plan-checklist. miguel, e.,c.camerer, k.casey, j.cohen, k. m. esterling,a.gerber, r. glennerster, d. p. green, m. humphreys, g. imbens, d. laitin, t. madon, l."
,,,,," 2012. “a pre-analysis plan checklist.” world bank. http://blogs. worldbank.org/impactevaluations/a-pre-analysis-plan-checklist. miguel, e.,c.camerer, k.casey, j.cohen, k. m. esterling,a.gerber, r. glennerster, d. p. green, m. humphreys, g. imbens, d. laitin, t. madon, l. nelson, b. a. nosek, m. petersen, r. sedlmayr, j. p. simmons, u. simonsohn, and m. van de"
,,,,,"” quarterly journal of economics 116 (1): 121–160. olken, benjamin a. 2015. “promises and perils of pre-analysis plans.” journal of economic perspectives 29 (3): 61–80. open science collaboration. 2015. “estimating the reproducibility of psychological science.” science 349: aac4716. rosenthal, robert. 1979. “the ‘file drawer problem’ and tolerance for null res"
10.1017_s1049096516002389,Reducing political bias in political science estimates,PS: Political Science \& Politics,24,"stimates. these biases can be reduced or eliminated through preregistration and preacceptance, with researchers committing to a research design before completing data collection. removing the potential for reporting flexibility can raise the credibility of political science research. p olitical science is an important tool for understanding and improving the world (see sides 2013); but several recent events have raised questions about political science research ",
,,,,"plish— mechanisms for eliminating reporting flexibility are preregistra- tion (see monogan 2015) and preacceptance (see nyhan 2015). in a preregistered study, researchers announce their planned research design choices before completing data collection, and then report results from this preannounced research design; readers can thus have more confidence that reported results have not been influ- enced by reporting bias. preregistration has an advantage that resea",
,,,,"(see monogan 2015) and preacceptance (see nyhan 2015). in a preregistered study, researchers announce their planned research design choices before completing data collection, and then report results from this preannounced research design; readers can thus have more confidence that reported results have not been influ- enced by reporting bias. preregistration has an advantage that researchers can announce planned research design choices unilaterally, but a shortc",
,,,,"orted results have not been influ- enced by reporting bias. preregistration has an advantage that researchers can announce planned research design choices unilaterally, but a shortcoming of preregistration is that there is no guarantee that preregistered studies will enter the literature. this shortcoming can be eliminated through preacceptance of articles in which journals agree to publish an article based on a preregistered research design no matter what the r",
,,,," research design choices unilaterally, but a shortcoming of preregistration is that there is no guarantee that preregistered studies will enter the literature. this shortcoming can be eliminated through preacceptance of articles in which journals agree to publish an article based on a preregistered research design no matter what the results are, as was done in a special issue of comparative political studies (findley et al. 2016).5 monogan (2013) is an exemplar ",
,,,,"oming of preregistration is that there is no guarantee that preregistered studies will enter the literature. this shortcoming can be eliminated through preacceptance of articles in which journals agree to publish an article based on a preregistered research design no matter what the results are, as was done in a special issue of comparative political studies (findley et al. 2016).5 monogan (2013) is an exemplar of a preregistered study. the preregistered monogan",
,,,,"es in which journals agree to publish an article based on a preregistered research design no matter what the results are, as was done in a special issue of comparative political studies (findley et al. 2016).5 monogan (2013) is an exemplar of a preregistered study. the preregistered monogan (2010) file describes the planned research design to assesswhether a republican house candidate’s percent- age of the major-party vote in 2010 was influenced by the tone of t",
,,,," (findley et al. 2016).5 monogan (2013) is an exemplar of a preregistered study. the preregistered monogan (2010) file describes the planned research design to assesswhether a republican house candidate’s percent- age of the major-party vote in 2010 was influenced by the tone of the candidate’s website statement on immigration. the preregis- tered file identified the planned outcome variable, explained how the explanatory variable would be measured, identified w",
,,,,"monogan (2013) is an exemplar of a preregistered study. the preregistered monogan (2010) file describes the planned research design to assesswhether a republican house candidate’s percent- age of the major-party vote in 2010 was influenced by the tone of the candidate’s website statement on immigration. the preregis- tered file identified the planned outcome variable, explained how the explanatory variable would be measured, identified which control variables wo",
