file_in,title,journal,count_prereg,prereg_context,prereg_term_context
,,,,"rowly ineligible voters are exposed to the op- portunity to preregister, whereas most of those who are narrowly eligible to vote register “regularly” (i.e., when they are already 18). they conceptualize narrowly ineli- gible voters as the treatment group and narrowly eligible voters as the control group; ineligibility is an instrument for preregistration, which is the treatment of interest. their analysis is based on a fuzzy rd design where ineli- gibility induc",
,,,,"rs as the control group; ineligibility is an instrument for preregistration, which is the treatment of interest. their analysis is based on a fuzzy rd design where ineli- gibility induces preregistration. our reanalysis of holbein and hillygus’s (2015) florida results, which uses the comprehensive replica- tionmaterialstheygenerouslyprovided,differsfromtheir original study in important ways. we are primarily inter- ested in illustrating how differential registra",
,,,,"is based on a fuzzy rd design where ineli- gibility induces preregistration. our reanalysis of holbein and hillygus’s (2015) florida results, which uses the comprehensive replica- tionmaterialstheygenerouslyprovided,differsfromtheir original study in important ways. we are primarily inter- ested in illustrating how differential registration patterns between treatment and control groups can affect turnout studies that calculate turnout rates as a proportion of re",
,,,," treatment of interest is voting eligibility (as opposed to preregistration), narrowly eligible voters are the treatment group, and narrowly ineligible voters are the control group. our design is thus analogous to the intent-to-treat (itt) analysis that they report in the article except that the treatment and control group labels are inverted. effects of eligibility on turnout-to-registration rates we first estimate the effect of voting eligibility on future tur",
,,,,"st-ineligible registrants who were exposed to the option to preregister in 2008 voted at a higher rate in 2012 (51.88%) than registrants who in 2008 were just- eligible (49.08%). this estimate is very close to the 3 percentage-point effect that holbein and hillygus (2015) report for their itt estimate.14 in the larger window of 2 months on either side of the cutoff, we find a similar pattern, with just-ineligibles again being slightly more likely to turn out tha",
,,,,"he cutoff. table 9 is the itt effect divided by the rate of preregistration in the just- ineligible group (preregistration is zero by construction among eligibles). a change in the sign of the itt effect would thus result in a change in sign in the tot effect as well. 758 brendan nyhan, christopher skovron, and rocío titiunik shows that the turnout-to-registration effect estimate in this window continues to resemble the one found by holbein and hillygus (2015).",
,,,," the rate of preregistration in the just- ineligible group (preregistration is zero by construction among eligibles). a change in the sign of the itt effect would thus result in a change in sign in the tot effect as well. 758 brendan nyhan, christopher skovron, and rocío titiunik shows that the turnout-to-registration effect estimate in this window continues to resemble the one found by holbein and hillygus (2015). however, when we calcu- late the estimated tur",
,,,,"shine hillygus. 2015. “mak- ing young voters: the impact of preregistration on youth turnout.” american journal of political science 60(2): 364– 82. 760 brendan nyhan, christopher skovron, and rocío titiunik jennings, m. kent, laura stoker, and jake bowers. 2009. “poli- tics across generations: family transmission reexamined.” journal of politics 71(3): 782–99. manski, charles. 2003. partial identification of probability dis- tributions. new york: springer-verl",
,,,,"t-to-births rates s5: results for study 1 in states without preregistration s6: birth, registration, and vote totals: study 1 s7: total births by day and month s8:sensitivityanalysisexample:votingrightsrestorations",
10.1111_ajps.12408,Predispositions and the political behavior of american economic elites: evidence from technology entrepreneurs,American Journal of Political Science,3,"elated policy domains. most impor- tantly, with a series of preregistered comparisons and sur- vey experiments, we show that technology entrepreneurs’ opposition to government regulation can be traced at least partly to positive predispositions toward markets and entrepreneurship—predispositions we also show are already evident in a sample of undergraduate computer science majors who have demonstrated interest in joining the industry in the future. we also show ","to technology entrepreneurs applying our argument to technology entrepreneurs, we hypothesized in a pre-analysis plan15 that technology en- trepreneurs would share a distinctive set of values and predispositions that would correspond with a distinctive set of political views. we consider views in four main policy domains: redistribution, regulation, globalizat"
,,,,"ot just problems here at home, to support free trade, 15 we preregistered our predictions and how we would test them in a pre-analysis plan, described in si appendix j, before collecting the confirmatory data set described below that we use to test our hypotheses. the undergraduate survey was inspired by reviewer comments and therefore was not part of the pre-analysis plan. 218 david e. broockman, gregory ferenstein, and neil malhotra and to allow much greater i","at home, to support free trade, 15 we preregistered our predictions and how we would test them in a pre-analysis plan, described in si appendix j, before collecting the confirmatory data set described below that we use to test our hypotheses. the undergraduate survey was inspired by reviewer comments and therefore was not part of the pre-analysis plan. 218 dav"
,,,,erests of the technology industry. 27 this analysis was not preregistered; we conceived it on the basis of a comment from a peer reviewer. table 6 technology entrepreneurs no more likely to oppose regulating technology products than democratic groups dv = opposition to regulation of particular products and services (0–1 scale) technology elites 0.083∗∗ (0.014) tech product/service 0.053∗∗ (0.006) technology elites × tech product/service 0.012 (0.016) constant (b,"heses. the undergraduate survey was inspired by reviewer comments and therefore was not part of the pre-analysis plan. 218 david e. broockman, gregory ferenstein, and neil malhotra and to allow much greater immigration.16 technology elites may, of course, also have economic rationales for supportingincreasedtradeandhigh-skilledimmigration. third, we expected t"
,,,,,"urveys of random subsamples of these individuals to formulate our hypotheses and register them in a pre-analysis plan. we next attempted to survey an independent group of 4,245 individuals in this frame to test our hypotheses. this sur- vey received 691 responses, a response rate of 16%.18 we only analyze data from u.s. citizens and residents, which excludes 8"
,,,,,"rvals among (a) the entire public, (b) just those in the public who identify as democrats,22 21 our pre-analysis plan, given in si appendix j, specified which survey items we would combine into each index and gives the item wordings. table 1 gives a summary of the items we use to form each of the four scales. si appendix b gives the marginal distribution on ev"
,,,,,"ly test the relevant hypotheses about differences between the groups we discuss, as laid out in our pre-analysis plan. 22 we ask the standard american national election studies party identification question and include leaners as partisans. (c) just those people in the public who identify as democrats and have college degrees,23 (d) just demo- cratic donors, ("
,,,,,trepreneurs to other groups appendix i: forbes 400 individuals coded as in technol- ogy appendix j: pre-analysis plan and questionnaire appendix k: references for appendices
10.1111_ajps.12428,Non‐governmental monitoring of local governments increases compliance with central mandates: a national‐scale field experiment in china,American Journal of Political Science,5,ts and discussions about earlier drafts of this article. we preregistered the design of this study and our plans for analysis prior to assigning treatment at the evidence in governance and politics registry (registration: 20150723aa). this research is supported by a grant from the national science foundation of china (grant no. 71825005) to bz. the authors are ordered alphabetically with the following contributions: mb and bz conceived of the study; all authors ,"e pre-treatment year and the two post-treatment years.5 hypothesis testing following our registered preanalysis plan, we test whether observed treatment effects are inconsistent with the sharp null hypothesis using randomization inference. for each outcomepresentedbelow,theobservedaveragetreatment effect in the sample for each measure is a difference- 5 we co"
,,,,"tes for transparency about pollution and its regulation. as preregistered, we use the change in the overall piti score and its compo- nent parts from the pre-treatment baseline to each of two post-treatment years as the main outcome variable (see si appendix a for a detailed description of the scores). the component parts of the piti score provide insights into the areas of transparency by city governments that change over time. increases in the overall and comp",
,,,,"his randomization distribution to compute p-values. also as preregistered, we estimate heterogeneous effects by pre- treatment piti score and pre-treatment measures of city- level citizen petitioning related to the environment us- ing multiplicative interaction in an ols model (see si appendix d). monitoring local governments in china 635 results main results the treatment — public disclosure of piti scores — increases compliance of city governments with mandate",
,,,," local officials (reported below). heterogeneous effects we preregistered a number of tests for heterogeneous treatment effects, with the goal of better understanding the types of cities that respond to treatment. although we recognized at the outset of the project that we had limited power to detect heterogeneous effects, we considered it desirabletotestforthemtoshedlightonplausiblereasons for treatment effects. in particular, we test whether treat- menteffects",
,,,,"ce intervals derived from blockwise bootstrap sampling. the preregistered search phrases “piti” never appeared in news headlines and is thus not displayed. si figure c1 shows similar results for full-text baidu search of news media. governance in authoritarian settings, we conducted a series of interviews with 20 municipal epb officials in our sample, seven ngos that adopted the piti in- tervention, and three local scholars from cities in our sample knowledgeabl",
10.1111_ajps.12468,"Cultivating clients: reputation, responsiveness, and ethnic indifference in india's slums",American Journal of Political Science,1,"iew board approval from american university (15098) and was preregistered with evidence in governance and politics (20160813). ved prakash sharma and the survey team provided excellent research assistance. this research was made possible by grants from the macmillan center, yale university, and the school of international service, american university. sufficiently investigate the factors structuring the bottom- up responsiveness of brokers to quotidian requests ",
10.1111_insp.12018,National security council: simulating decision-making dilemmas in real time,International Studies Perspectives,1,"nts are appropriately self-selected into the simulation. if preregistration screening processes are not permitted, on the first day of class, the instructor should review the syllabus and course expectations with students and consult with students who are unsure about fit. jonathan m. dicicco 441 downloaded from https://academic.oup.com/isp/article/15/4/438/1804012 by r.g. menzies library, building #2, australian national university user on 11 august 2021 assign",
10.1111_j.1467-9299.2011.01980.x,Removing the cultural and managerial barriers in project-to-project learning: a case from the uk public sector,Public Administration,1," to drop the requirement for providers to be accredited and pre-registered. public administration vol. 90, no. 3, 2012 (664–684) © 2011 blackwell publishing ltd. 672 mark hall et al. april 1997 december 2002 jan 1998 jan 1999 jan 2000 jan 2001 jan 2002 may 1997 labour party manifesto apr 1999 tecs offer limited number of accounts jul 2000 capita wins contract to run ila scheme learning and skills act 2000 – royal ascent sep 2000 individual learning accounts regul",
10.1111_lsq.12242,Constituent communication through telephone town halls: a field experiment involving members of congress,Legislative Studies Quarterly,4," constituents from the corresponding congressional district pre-registered for a telephone town hall scheduled to be hosted by their mc.15 at the time of the scheduled session, the telephone town hall software platform dialed all the registered participants at the phone numbers they provided. to ensure that the number of participants in these events mirrored those in a normal telephone town hall, we conducted additional random call-outs using the recruitment list","2018. this page has been taken down, but the video can be found at https://www.youtube.com/watch?v=cosfhwhsp8k, last accessed march 13, 2019. 4 to our knowledge, the only existing study of constituent reactions to telephone town halls comes from a 2007 research report from the congressional institute (congressional institute 2007). this report describ"
,,,,"is software error, see appendix figure a1. 15 the number of pre-registered participants varied across the four mcs: desaulnier (429), larsen (146), moulton (128), and takano (237). participants could indicate they were available for both sessions scheduled for their district, and these were randomized into a session. was 491 constituents.16,17 we did not label the registered participants, so that those conducting the town hall were not aware of who was registered",
,,,,"umbers of participants, allowed constituents to sign up and pre-register for a telephone town hall session, a departure from typical practice where constituents are cold-called without advance notice. these deviations from current practice helped structure a systematic study of telephone town halls. in fact, the deviations do not substantially change the telephone town hall experience or structure—the treatment and control conditions both very closely approximate",
,,,,"bjects did not know about the details of their session upon preregistration. therefore, we assume that selection into treatment is ignorable, and hence that the parallel path assumption is plausible. our findings are local to constituents who select into a telephone town halls and the kind of mcs who participated in our study. under our design, we can evaluate the reactions to the telephone town halls among those who accepted our invitation to participate and so",
10.1111_padm.12101,'{Democratizing}' public services? {Representation} and elections in the scottish nhs,Public Administration,1,"- and 17-year olds (those born after november 1993 who were pre-registered) could both vote and stand as candidates. election expenditures were limited to £250; to put this figure in context, over 350,000 people live in fife. between 8 and 13 may 2010, local returning officers issued voting packs to eligible voters. the voting packs included the election state- ments, listed alphabetically, and a ballot paper. polls closed at 4pm on 10 june 2010. the elected memb",
10.1111_padm.12688,Question order bias revisited: a split‐ballot experiment on satisfaction with public services among experienced and professional users,Public Administration,4,"valid performance infor- mation remains incomplete. using a preregistered split- ballot experiment among government grant recipients in denmark, this article shows that the ordering of survey questions can bias satisfaction measures even for highly experienced and professional respondents. we find that asking about overall satisfaction before any specific service ratings lowers overall user satisfaction, compared to the reverse order, while the correlations betw",
,,,,"ciated with receiving and spending the grant. we embedded a preregistered split-ballot experiment that randomly assigned respondents to different survey versions: (1) one that asked about overall satisfaction before asking about specific services, (2) and another that asked about overall satisfaction after having probed specific service ratings. our results support that question order bias occurs in satisfaction surveys, but also qualify recent findings. con- tr",
,,,,"periment similar to van de walle and van ryzin's (2011) and preregistered it in the american economic association's registry for randomized controlled trials.2 specifically, we made two different ver- sions of the user satisfaction survey and assigned respondents to one of them based on chance. both survey ver- sions asked the same questions but varied in terms of question order. by design, this random assignment ensures that any difference in outcomes between t",
,,,,"irst’ and ‘specific first’ versions of the survey 2 for the preregistration, see https://doi.org/10.1257/rct.3326-1.0 thau et al. 195 management of the national board of social services?’ responses were given on a 10-point scale from 1 ‘very dis- satisfied’ to 10 ‘very satisfied’. the sample mean is 6.34 with a standard deviation of 2.24. respondents' specific service ratings were all measured using 5-point likert-scaled questions, as in van de walle and van ryz",
10.1111_pops.12626,Taming uncivil discourse,Political Psychology,1,"isted in the four-and-a-half-page-long table. 8 we have not preregistered these hypotheses, although we do note that most were formulated in a proposal for funding this project (available from the authors upon request), a proposal written, of course, well before any data were collected or analyzed. 388 gibson et al. was exposed and, in predicting disparagement perceptions, that sdo interacts with motives attribu- tions. those high in social dominance are unlikel",
10.1111_pops.12669,The influence of identity salience on framing effectiveness: an experiment,Political Psychology,1,"result in more effective political communication. through a preregistered survey experiment (n = 978), this study tested how priming either a partisan or a nonpartisan (parental) identity influenced the effectiveness of a climate change frame on several attitudinal outcomes. findings suggest that identity salience—specifically partisan identity salience—can influence the effectiveness of a frame. among republican parents, receiving a message about the impact of ","a control group. 1 the experiment and hypotheses were registered prior to receiving the data in the egap registration system, id 20180416aa. 1138 diamond h5: priming a parental identity before presenting a future-generations frame will increase climate concern, proenvironmental behaviors, and climate change policy support among democrats, compared to a"
10.1111_pops.12706,Hearing from both sides: differences between liberal and conservative attitudes toward scientific and experiential evidence,Political Psychology,11,"titudes toward science, reasoning style, reasoning ability, preregistered, intuition recently, researchers have bemoaned that scientific controversies are being decided in the court of public opinion rather than scientific expertise (e.g., lewandowsky, ecker, & cook, 2017). scientists are troubled by media channels that insist on presenting “both sides” of arguments that have already been settled, and online forums allow anyone’s voice to be heard as easily as a","in parentheses (hypotheses were reordered for clarity of presentation): 1 https://doi.org/10.17605/​osf.io/khdgf 2 https://doi.org/10.17605/​osf.io/fg6c3 3 the “feelings are truth” scale was included as a subscale with two other new constructs of the authors’ creation that were also included in these studies, as specified in the preregistrations. we h"
,,,,"iew and hypotheses here we present results from two similar preregistered studies, study 11 from may 2018 and study 22 from july 2018. in both studies, participants were initially screened on ideology, then they read a supposed article excerpt where a researcher was quoted as debunking a popular misconcep- tion. an alternative viewpoint followed, rejecting the researcher’s viewpoint. participants then eval- uated the views of both the researcher and the rejecter"," for clarity of presentation): 1 https://doi.org/10.17605/​osf.io/khdgf 2 https://doi.org/10.17605/​osf.io/fg6c3 3 the “feelings are truth” scale was included as a subscale with two other new constructs of the authors’ creation that were also included in these studies, as specified in the preregistrations. we had additional preregistered hypotheses co"
,,,,"hypotheses tested in study 1 that we specified in the study preregistration, with preregistration hypotheses numbers in parentheses (hypotheses were reordered for clarity of presentation): 1 https://doi.org/10.17605/​osf.io/khdgf 2 https://doi.org/10.17605/​osf.io/fg6c3 3 the “feelings are truth” scale was included as a subscale with two other new constructs of the authors’ creation that were also included in these studies, as specified in the preregistrations. ",
,,,,"tudy 1 that we specified in the study preregistration, with preregistration hypotheses numbers in parentheses (hypotheses were reordered for clarity of presentation): 1 https://doi.org/10.17605/​osf.io/khdgf 2 https://doi.org/10.17605/​osf.io/fg6c3 3 the “feelings are truth” scale was included as a subscale with two other new constructs of the authors’ creation that were also included in these studies, as specified in the preregistrations. we had additional prer",
,,,,"at were also included in these studies, as specified in the preregistrations. we had additional preregistered hypotheses concerning these other constructs that were largely confirmed, although they were cut from the current article for the purposes of clarity. a brief report of these hypotheses and the related results are in appendix s4 in the online supporting information, and an earlier version of the full paper containing these hypotheses and their results is",
,,,,"es, as specified in the preregistrations. we had additional preregistered hypotheses concerning these other constructs that were largely confirmed, although they were cut from the current article for the purposes of clarity. a brief report of these hypotheses and the related results are in appendix s4 in the online supporting information, and an earlier version of the full paper containing these hypotheses and their results is available from the authors. 447 hea",
,,,,"cher but differ in that conservatives elevate the rejecter (preregistration h5). we started with this strong hypothesis as an attempt to balance the “symmetry” and “asymmetry” ideas wherein the two ideological groups actually agree on the scientist (hence showing symmetry) but disagree on the rejecter (hence showing asymmetry). h2: the feelings are truth scale scores will be correlated with crt scores, rei-faith in intuition scores, and rei-need for cognition sc",
,,,,"ith in intuition scores, and rei-need for cognition scores (preregistration h3). this provides evi- dence of convergent validity of the new feelings are truth scale, as these are related constructs pertaining to reasoning style and ability. h3: the feelings are truth scale will mediate the effect of ideology on valuing the “science rejecter,” even when controlling for rei-fi, rei-nfc, and crt scores (preregistration h6). in this hypothesis, we focus on the scien",
,,,," even when controlling for rei-fi, rei-nfc, and crt scores (preregistration h6). in this hypothesis, we focus on the science rejecter, rather than the researcher. since the rejecter’s viewpoint is grounded more in gut feelings than the researcher’s viewpoint, rejecter evaluation fit best as a dv for a mediation analysis. a caveat regarding causality is necessary. following recent research on ideological splits (e.g., baron & jost, 2019; ditto et al., 2019; tulle",
,,,,"t closely identified with. this categorical measure was our preregistered main independent variable in both studies. for exploratory purposes, we also included a measure of policy beliefs. following feldman and johnston (2014), we used questions from the american national elections studies (anes) to measure ideology, including a four-item measure of economic ideology (assessing attitudes towards government spending, medical insurance, assistance to the poor, and",
,,,," dv mediation models in study 2 appendix s4. results of all preregistered hypotheses table s4.1. factor analysis results for studies 1 and 2. table s4.2. correlations between bifyots sub-scales and covariates table s4.3. correlations between reality is subjective, feelings are truth, and evaluation of the researcher and science rejecter table s4.4. partial correlations between reality is subjective, feelings are truth, and evaluation of the researcher and scienc",
